file_id,year_month,title,loc,text,scope,year,month,city,state,region
1900490300,1966-07,Nashville Tennessean (1923-1972),nashville,"Inflation breeds mediocrity, weakens the sense of frugality and thrift ln people.",local,1966,7,nashville,tennessee,southeast
840778111,1978-05,Boston Globe (1960-),"boston, mass",The nation's No. 1 domestic problem is inflation.,local,1978,5,boston,massachusetts,northeast
1901904390,1978-08,St. Louis Post-Dispatch (1923-),st louis,"Panlasigui said Clay ""has offered no solutions to rising interest rates and inflation. inflation.",local,1978,8,st louis,missouri,midwest
1903246760,1975-07,St. Louis Post-Dispatch (1923-),st louis,The dollar was weak in late 1974 and early 1975 despite an improvement in the U. S. trade balance and a slackening in the pace of inflation.,local,1975,7,st louis,missouri,midwest
2485495087,1978-03,Tennessean (1972-) The,nashville,"When you stop to consider that only 12 American global banks hold 83 of America's foreign deposits; 90 of the indebtedness of the petroleum and natural gas industry is held by nine banks, then you get a much clearer idea of why there is no longer an interest rate ceiling in Tennessee and why we are plagued by crippling crippling inflation.",local,1978,3,nashville,tennessee,southeast
147261740,1980-03,Washington Post  (1974-) The,"washington, dc",Roundup Roundup World: Dollar Up Dramatically The dollar chalked up some dramatic gains on foreign exchange markets yesterday on speculation that the administration s anti-inflation program will be announced early next week.,national,1980,3,washington,district of columbia,northeast
171886931,1979-02,Chicago Tribune (1963-1996),"chicago, ill","""I don't want to sound like a - na,"" Kahn told the Senate Banking Com- mittee as he asserted that there is still a ""strong probability"" that the adminis- tration s anti-inflation goals could be met.",local,1979,2,chicago,illinois,midwest
147705912,1969-03,"Washington Post, Times Herald  (1959-1973) The","washington, dc","TRADERS AND INVESTORS know that real progress In checking inflation would-like peace-ease demands for credit and let irk Merest rates decline, But many doubt that the author sties here will do the hard things necessary to check the wage-price spiral.",national,1969,3,washington,district of columbia,northeast
1905871029,1970-07,Nashville Tennessean (1923-1972),nashville,THE INFLATION Of CEILING CEILING WHITE TILE SFT; ill v.,local,1970,7,nashville,tennessee,southeast
1877236782,1970-12,Minneapolis Tribune (1964-1982),minneapolis,The advocates of very rapid expansion expansion of demand and output in 1971 believe that it can be accomplished accomplished without making the inflation problem worse.,local,1970,12,minneapolis,minnesota,midwest
747775520,1975-04,Boston Globe (1960-),"boston, mass","Collsiuer io .1n  lit, 2 and other   into Conord and Ji n ii gton  ICud tilly l  in to the worl ds larg ti parking lot  CuriositY  Itr\y io  lilt,. tOW1e two h111111C  L es 111C t heW A II'l 19 BikentraYuiiniembtr Pre'ident Ftortf fanous WIN "" Whip inflation Now. Well. that 1i1t1e project wa luch a hos0 that  re  bi-ng   ria.The  .,oan o Inun1 Miracles.",local,1975,4,boston,massachusetts,northeast
2430997769,1978-08,Tennessean (1972-) The,nashville,"That's below the overall inflation rates of 6 to 7, the agency said.",local,1978,8,nashville,tennessee,southeast
1878241018,1974-06,Minneapolis Tribune (1964-1982),minneapolis,"People are, again, ;back to - this something, somebody, they can trust, they can believe in. , ""Timing for someone, in my category was good, and I'd like .to think that positions I took on issues are what people of: this state, a majority of the people, feel, .be it on capital capital punishment or amnesty or inflation or agriculture or whatever.""",local,1974,6,minneapolis,minnesota,midwest
117937942,1967-12,New York Times  (1923-),"new york, ny","In some of the areas it is as high as 19 to 20 per cent "" Dr. Traywick noted that Virginia cannot escape the effects of predicted inflation in 1968, but if the state s productivity is high then           can be curtailed.",national,1967,12,new york,new york,northeast
133622772,1971-02,Wall Street Journal  (1923-),"new york, ny",He said the laws will provide for an additional rise of five cents a year in the base price of Mideast oil plus a 3% increase annually to offset world inflation.,national,1971,2,new york,new york,northeast
1877726417,1971-08,Minneapolis Star (1947-1982),minneapolis,The third indispensable element in building the new prosperity is closely related to creating new jobs and halting inflation.,local,1971,8,minneapolis,minnesota,midwest
158913362,1979-08,Los Angeles Times (1923-1995),"los angeles, calif",An American official says that Is-  are better off with 80% annual inflation-the current rate-than Americans with a rate one-sixth as high.,local,1979,8,los angeles,california,west
1867957982,1973-07,Courier-Journal (1923-) The,louisville,"One good thing THE ONLY good thing about inflation, figures Jack O'Brien of Louisville, is that you no longer have to worry about calories calories when you eat a dime candy bar.",local,1973,7,louisville,kentucky,southeast
1878379532,1975-03,Minneapolis Tribune (1964-1982),minneapolis,Inflation began with escalation escalation in Vietnam.,local,1975,3,minneapolis,minnesota,midwest
147298790,1980-01,Washington Post  (1974-) The,"washington, dc","Continued inflation, combined with i increased threats to the dollar from he Iranian situation and the energy h0, effectively have boxed the ,)resident in and prevented any new' i noves on the domestic front.",national,1980,1,washington,district of columbia,northeast
1878733452,1978-10,Minneapolis Tribune (1964-1982),minneapolis,"I know they need it more than anyone else, but other people also have had increases because of inflation inflation and that ought to be taken into consideration as well, not just the Relax in the nation's first and finest indoor garden courtyard i - ji tin,. jgfc.ar m w r - W I'.tXi f-fcT .1 t It I caiurihg year-round swimmine, uhirlnnnl cwn shnf I'lrhoiml enjoy the good food and t un of Ambassador's coy Camfiio Room . . . ana tne world s tine timing pleasures oi as exotic Kasiimin kooiii. ur one of the 200 deluxe suites . . . complete banquet and meeting taeiliiies . and the free paiking and courtesy liniosine service in the Greaki 1inneapolis shopping area.",local,1978,10,minneapolis,minnesota,midwest
157841023,1975-04,Los Angeles Times (1923-1995),"los angeles, calif",But McCarthy said that because of a combination of inflation and in- creased state welfare costs the sur- plus has 'virtually disappeared.',local,1975,4,los angeles,california,west
1889082554,1980-10,Cincinnati Enquirer (1923-),cincinnati,"Compare Carter-Mondale's anti-inflation czar, pleading for reason.",local,1980,10,cincinnati,ohio,midwest
294011459,1980-11,Boston Globe (pre-1997 Fulltext),"boston, mass","Wirthlin said that based on his polling, the electorate's primary expectation ""is that the economy will improve and we will get inflation under control.""",local,1980,11,boston,massachusetts,northeast
179021534,1966-08,Chicago Tribune (1963-1996),"chicago, ill",Yet the administration is aware that inflation with rising prices for every household is the major problem of today..,local,1966,8,chicago,illinois,midwest
118934725,1970-01,New York Times  (1923-),"new york, ny","As former dean of a graduate school of business, Dr. Shultz undoubtedly has credentials to advise on monetary policy--even though little in the present runaway state of inflation seems to justify this particular bit of advice.",national,1970,1,new york,new york,northeast
1877905438,1972-01,Minneapolis Star (1947-1982),minneapolis,"""The solutions seldom will be immediate or ideal,"" he said, ""in part because of technical problems and high costs, in part because of priorities that must also be assigned assigned to other broad problems such as urban renewal, unemployment, health care, inflation, education, transportation transportation and a host of other social concerns.",local,1972,1,minneapolis,minnesota,midwest
1876521983,1967-12,Minneapolis Star (1947-1982),minneapolis,But just about everyone we know says that we should stay clear of bonds and invest in stocks because of inflation.,local,1967,12,minneapolis,minnesota,midwest
171740515,1978-07,Chicago Tribune (1963-1996),"chicago, ill","Donald S. Kemp, the bank s interna- tional economist, predicted that inflation rates among the world s major curren- cies will ""follow essentially the same pattern over the next few years that they have followed over the past five.""",local,1978,7,chicago,illinois,midwest
1906602880,1976-01,Tennessean (1972-) The,nashville,"There was progress in combatting inflation, as prices increased about 7 per cent in 1975, lower than the 12.2 per cent inflation rate of 1974.",local,1976,1,nashville,tennessee,southeast
1867489346,1970-08,Courier-Journal (1923-) The,louisville,I860 29 SZ 898 W55 33 Ibs. 1900 29S2 899 fU . city shown is based on maximum cold inflation pressure ot 32 lbs. per square Kst performance see your car manual fur inllation recommendations.,local,1970,8,louisville,kentucky,southeast
121286277,1980-03,New York Times  (1923-),"new york, ny","However, such exemption does accomplish two very important objectives: It would be a great help to low-and moderate-income persons and those living on fixed incomes-a tax cut for the people who need it the most, the people who have carried the heaviest burden of inflation. i It would give those of us who are committed to tax reform a foot in the door.",national,1980,3,new york,new york,northeast
1878314738,1974-12,Minneapolis Star (1947-1982),minneapolis,"Dr. Herbert E. Neil Jr. adds that ""the weak economy will moderate inflation."" ...",local,1974,12,minneapolis,minnesota,midwest
133715397,1972-08,Wall Street Journal  (1923-),"new york, ny","Particularly with regard to price inflation, the key fundamental is the growth of the money stock.",national,1972,8,new york,new york,northeast
158098060,1976-11,Los Angeles Times (1923-1995),"los angeles, calif","Jack Carr, a respected economist at the University of Toronto, reinforced this point, declaring ""I see nothing to prevent a period of 10-11% inflation after the controls are lifted.""",local,1976,11,los angeles,california,west
170034031,1979-05,Chicago Tribune (1963-1996),"chicago, ill",But dismal new statistics from the Labor Department supported adminis- tration warnings to Americans that bad inflation news will be standard fare for the next few months.,local,1979,5,chicago,illinois,midwest
146820642,1978-12,Washington Post  (1974-) The,"washington, dc","Their view, as reported by Laden, is that the persistence of a 9 to 10 percent inflation in the United States next year will renew selling pressure on the dollar, requiring the actual use of most or all of the $30 billion support package announced Nov. 1.",national,1978,12,washington,district of columbia,northeast
148290844,1972-03,"Washington Post, Times Herald  (1959-1973) The","washington, dc",Do we mean business or don't we when it comes to controlling inflation?,national,1972,3,washington,district of columbia,northeast
1893059466,1976-12,Indianapolis Star (1923-),indianapolis,"IN A COMPANION article, Theodore Theodore Moran predicts oil prices will go up 10 to 15 per cent per year above the level of inflation.",local,1976,12,indianapolis,indiana,midwest
491510244,1978-10,Atlanta Daily World (1932-),"atlanta, ga","To protect American jobs, the dollar s value, help check inflation and avoid a serious worldwide economic crisis.",local,1978,10,atlanta,georgia,southeast
202621454,1978-05,New Pittsburgh Courier (1966-1981),"pittsburgh, pa","The bulk of inflation is concentrated in four areas food, energy, health and housing.",local,1978,5,pittsburgh,pennsylvania,northeast
119939984,1974-08,New York Times  (1923-),"new york, ny","Since West Germany has led the world in combatting inflation, it is aware of the difficulty of arguing that other countries should do the same.",national,1974,8,new york,new york,northeast
1867907256,1973-11,Courier-Journal (1923-) The,louisville,"For a review of your homeowners insurance needs and details about Inflation-Guard, Inflation-Guard, call your Motorists agent.",local,1973,11,louisville,kentucky,southeast
1819201142,1966-02,Detroit Free Press (1923-),detroit,"Rep, Lucien Nedzi . . . . . . who has just polled the Man with the Dinner Pail in the 14th District, has found deep concern over water and air pollution; heavy support in favor of continuation of the draft; split opinion over admission admission of Red China into the United Nations; belief that Integration Integration is proceeding ""about right""; basic distrust of another tax cut as a means of combating inflation.",local,1966,2,detroit,michigan,midwest
423956544,1980-07,New York Times,"new york, ny",But that even they are concerned shows how pervasive the effects of inflation are.,local,1980,7,new york,new york,northeast
158917588,1979-05,Los Angeles Times (1923-1995),"los angeles, calif","* But he added that ""it s obvious you can t turn around a 10-year inflation- ary trend in the matter of two or Please Turn to Page 36, Col. 2",local,1979,5,los angeles,california,west
157565953,1974-09,Los Angeles Times (1923-1995),"los angeles, calif","The usual sources of money for those mortgages have dried up because of the competition for the dollar and the un- conscionable interest rates being offered for invest- ments other than the long- term mortgage at a locked- in rate-high as it is now at about 9'/i% Home, Housewife Fourth, inflation is kill. ing housing just as it is killing the housewife al the supermarket and the beer-loving guys who can -and some do-pay as high as $1.85 for a mug of good draft suds in this town that generally tends to Bourbon, Scotcb and martinis.",local,1974,9,los angeles,california,west
1878378538,1975-07,Minneapolis Tribune (1964-1982),minneapolis,"""Inflation is entirely the reason,"" said Symes-Thompson.",local,1975,7,minneapolis,minnesota,midwest
1868079299,1974-10,Courier-Journal (1923-) The,louisville,He remarked that our system cannot indefinitely withstand the effects of double-digit inflation.,local,1974,10,louisville,kentucky,southeast
1887096202,1964-10,St. Louis Post-Dispatch (1923-),st louis,"Although the White House described the new auto contracts as ""generous,"" it did not exactly oppose them as endangering Administration Administration guidelines for avoiding inflation and Improving our international balance of payments payments position.",local,1964,10,st louis,missouri,midwest
747158244,1979-03,Boston Globe (1960-),"boston, mass","GE testing the waters on property tax abatement MICHELSON City officials of Pittsfield look upon it as local fiscal disaster but the announcement his week that the General Electric company is Pittsfield for 58 percent abatement in real state assessment has message for every city and own that has industrial property on its property ax rolls To put the 58 percent abatement in focus GE which employs about 7600 in Pittsfield is now as sessed for real estate at 32 million about onetenth of the value of the whole city as computed by the local assessors The company maintains that the property is only about 13 million With the current tax rate of 79 per 1000 valuation GE this year is tagged for tax of about million But if the assessed valuation dropped to 13 million the tax would amount to about million The million loss of revenue to the city could mean ah increase in the tax rate of about 50 per 1000 There is message not only for other municipal officials but for members of the Legislature's Committee on Taxation where there are now pending bills to implement the classification amendment approved on the ballot last year Until last fall the constitution dictated that all property had to be assessed at full and fair cash value The amendment passed last fall allows assessors to value property by use shelf bill enacted last year as an accompaniment to the change in the constitution prescribed that open land was to be assessed at 25 percent of fair cash value real dential property at 40 percent of fair cash value property at 50 percent and industrial property at 55 percent The classification amendment can t be implemented in any community until the state s com- missioner of revenue has certified that ithas in fact achieved fair cash value which is the chinning bar for the whole so-called tax reform And it is in the realm of fair cash value that General Electric Is basing its case Assessors can zero in with some precision as to the value of residence They have all kinds of evidence particularly through sales as to how much willing buyer is ready to pay willing seller for house But for commercial and industrial property it s anybody s guess There are no real experts Even between General Electric plants in Massachusetts local assessors differ dramatically In Pittsfield with 7600 employees GE's assessed valuation is 32 million But in Lynn GE employs 13,600, obviously much bigger operation Its assessed valuation in Lynn is 15 million And the tax GE pays in Lynn about million is about the same as GE pays Pittsfield Obviously in Lynn the assessors are more accommodating The thesis of GE's case for massive abate- ment in Pittsfield rebuts the idea that industry can be made an easy target which the mayors who promoted the classification amendment seemed to imply in their campaign last fall It notes with some documentation that while inflation appreciates the value of residential property just the opposite occurs with old industrial property which has been made obsolete in many instances by technological advances Up to this point GE has been indulgent with Pittsfield's burgeoning budget over the past 14 years So long as it continued to pick up the same 10 percent of the cost of operating the city it seemed content It has been supportive of expen sive building projects downtown development and an improved education program But with the prospect of implementation of the classification amendment It apparently is not going to stand idle It's going to insist apparently on more precision in arriving at fair cash value And so pre sumably are lot of other industries In the state The other major flaw in the classification amendment there are several minor ones is that it doesn't do anything for serious reform of the property tax which is the bugaboo of the Massachusetts tax structure Indeed it makes reform that much more difficult to achieve because those who voted so overwhelmingly for It last fall were given feeling of contentment by Its promoters There is only one way to relieve property taxes and that is by replacing them with broad-based state taxes But history dictates that unless the proponents can recruit massive organization of well-funded dedicated advocates the graduated income tax doesn't have chance The idea of progressive tax is hard sell anytime but In these days of Proposition 13 emotionalism it would be Impossi ble IA Michelson is Political editor of the Hugle",local,1979,3,boston,massachusetts,northeast
1888342489,1969-02,Cincinnati Enquirer (1923-),cincinnati,"Now that the surtax has failed, the Federal Reserve is starting starting a new exercise in tight money to restrain inflation. inflation.",local,1969,2,cincinnati,ohio,midwest
1868091968,1974-09,Courier-Journal (1923-) The,louisville,When you buy you automatically automatically build equity. . .gain a hedge against inflation... and gain substantial income tax deductions every year.,local,1974,9,louisville,kentucky,southeast
1888534749,1972-10,Cincinnati Enquirer (1923-),cincinnati,"So long as Inflation con-t con-t i n u e s, the government reaps a progressively higher higher share of the gross national national product in taxes, without increasing the taxation taxation rate, says Stanfield.",local,1972,10,cincinnati,ohio,midwest
1901962902,1979-05,St. Louis Post-Dispatch (1923-),st louis,"He said the more difficult it is to evade a tax, the more unpopular the tax becomes and the more determined people are to evade or defy it. -? : partnership of Drury Industries of Cape Girardeau Girardeau and The May Stores Shopping Centers Inc. of St. Louis, will include a 100,000-square-foot Famous-Barr department store and 70 to 80 mall shops. inflation.",local,1979,5,st louis,missouri,midwest
757610525,1977-02,Boston Globe (1960-),"boston, mass","Policy sales at Hancock up 11.3% By Daniel Corcoran Globe Staff John Hancock Mutual Life Insurance Co individual policy sales were up 11.3 percent to billion last year Gerhard Bleicken board chairman told policyholders at their annual meeting yesterday That raised the company s total individual life insurance in force to 43 billion Bleicken said Group life insurance in force rose to 52 billion Bleicken said the gains were achieved despite severe problems in the nation s economy noting that we haven't yet learned how to handle inflation Problems of unemployment and the financial crises of the cities and towns continue to plague the country he said Of John Hancock's total life insurance in force more than 10 17 billion is in Massachusetts where residents purchased 928 million of new insurance last year More than 161 million was paid out in benefits in the state Bleicken said the company continues to be hampered by the state s gross investment tax on Massachusetts-based life insurance companies Hancock paid total of 15 million in taxes to the commonwealth last year more than three times what it would have had to pay in Connecticut Of that total more than million was the investment tax William M. Scranton has been elected president and a director of Beede Electrical Instrument Co. Inc., Penacook, N. H., manufacturers of custom meters and engine instru ments.",local,1977,2,boston,massachusetts,northeast
115812466,1964-05,New York Times  (1923-),"new york, ny","""Writing in The Boston University Business Review, Dr. Asht0n pointed out that United States world-wide commitments a/'e essentially, dependent, on the nation s productive potential 'and that 'if the continued ' presence ' of United States armed fores is politically and strategically desirable, it would be foolhardy to initiate co. action because of 'a fear of further inflation.",national,1964,5,new york,new york,northeast
133874351,1974-01,Wall Street Journal  (1923-),"new york, ny",Danish Prices and Profits Are Frozen Until Feb. 28 By a WALL STREET JOURNAL Staff Reporter COPENHAGEN A temporary freeze on prices and profits went into effect as the first step in a Danish government program to curb inflation.,national,1974,1,new york,new york,northeast
118194876,1968-03,New York Times  (1923-),"new york, ny","The transportation problem also created severe -with the exception of rice, canned ,milk anti locally produced  cau.qed severe inflation.",national,1968,3,new york,new york,northeast
146161043,1974-08,Washington Post  (1974-) The,"washington, dc",On Thursday in New Orleans Wallace also called for cuts iri. federal bureaucracy and spending as the cure for inflation..,national,1974,8,washington,district of columbia,northeast
1821880099,1979-12,Detroit Free Press (1923-),detroit,"But the Racheting Tax is the most fearsome of the species, always gobbling up more and more as inflation pushes incomes into higher tax brackets, swallowing up ever-larger slices of the gross national pie.",local,1979,12,detroit,michigan,midwest
171098899,1974-09,Chicago Tribune (1963-1996),"chicago, ill",I LIKE the Ideas here because retired per- sons and the disabled and persons living on pensions and fixed incomes are victimized worst by inflation.,local,1974,9,chicago,illinois,midwest
1893133999,1967-10,Indianapolis Star (1923-),indianapolis,"""If there wasn't a tragic war in Southeast Asia, if we had a stable economy without ruinous ruinous inflation if we had a relatively balanced budget if our cities had not been in strife . . . the Democrats could win.""",local,1967,10,indianapolis,indiana,midwest
1878210461,1974-01,Minneapolis Tribune (1964-1982),minneapolis,"For the rich, inflation, the energy shortage and rising rising food prices and unemployment unemployment are an irritation and at worst an inconvenience, inconvenience, but for the poor they are a disaster.",local,1974,1,minneapolis,minnesota,midwest
1868395078,1977-01,Courier-Journal (1923-) The,louisville,He said Congress has learned it must limit federal spending spending to reduce inflation.,local,1977,1,louisville,kentucky,southeast
226446520,1974-11,New York Amsterdam News (1962-),"new york, ny",Another discouraging intrusion has been inflation.,local,1974,11,new york,new york,northeast
117824264,1970-10,New York Times  (1923-),"new york, ny","The small bet here, with the second half of the game to begin, is that monetary policy will win by a field goal, and that this country will have neither boom nor raging inflation in 1971, despite a rather distressing deficit in the budget.",national,1970,10,new york,new york,northeast
1901562973,1974-09,St. Louis Post-Dispatch (1923-),st louis,"Terming the Federal Reserve Reserve more an accomplice of inflation than an independent independent controlling influence on the economy, Minsky called infusion of more equity capital capital into the banking system.",local,1974,9,st louis,missouri,midwest
1901471913,1973-12,St. Louis Post-Dispatch (1923-),st louis,The announcement vector-Aim in the House of Commons strengthened talk in London that Heath might call general elections earlv next vMrinm effort to win public approval for nis conservative government's ngnt against inflation and militant militant union leaders.,local,1973,12,st louis,missouri,midwest
