file_id,year_month,title,loc,text,scope,year,month,city,state,region
1893179862,1977-02,Indianapolis Star (1923-),indianapolis,"But juice prices are higher now than they were at the height of the freeze Page 14 WATER PROJECTS - Angry House Democrats summon up comparisons with the Nixon administration in denouncing President Carter's decision decision to stop new spending on 19 big water-control projects Page 14 ELECTION The election of Republican Republican Arlan Stangeland in Minnesota's Minnesota's special congressional election election is seen as a victory of a well-financed candidate w e 1 1 -attuned to his district Page 14 ECONOMY-Chatanan Arthur Burns of the Federal Reserve Board says President Carter's proposed additions additions to the 1978 Federal budget could drive inflation this ye;-r above the expected 5-6 per cent rate Page 59 STOCKS The market posts a slight loss amid persistent inflation worries; the Dow Industrials finish at 938.25, off 1.66 Page 59 NATURAL GAS A House subcomittee charges Gulf Oil Corporation violated Federal taw by failing to deliver contracted amounts of natural gas to a pipeline system serving 16 states Page 60 VOLUNTEER ARMY Becauseof escalating costs and a dwindling pool of manpower, the 4-year-old j volunteer army program is in serious trouble Page 72 HIGHLAND EFFORT - Mayor William H. Hudnut urges renewed consideration consideration and approval for the proposed Highland Dam and Reservoir Page 11 THE STORY OF AMERICA Despite the protests of Thomas Jefferson and states r i g h t e r s, Hamilton's Bank of the United States wins a charter Page 17 BUILDING COLLAPSE Owners of a downtown Noblesville building which collapsed as workmen were renovating renovating a tavern had failed to obtain a necessary permit before beginning the remodeling project, according to city officials Page 55 SUMMER JOBS Secretary of labor announces allocation of more than $15 million in Federal funds to provide provide summer jobs for disadvantaged youth Page 61 MURDER A 55-year-old owner of a janitorial service company was shot to death during an apparent robbery attempt after dropping an employe of f in the 2400 block of North Illinois Street, police say Page 62 Editorials ""The Mayor's Decision"" commends Mayor William H. Hudnut for a fair, balanced decision regarding religious displays on public property; ""Bar The Gold Rush"" says the $1.4 million legal fee awarded m the state pension case may send lawyers by the score in search of similar pension suits, and ""Tut, Tut, Tip"" chides Speaker of the House Thomas P. O'Neill for his arrogant defense defense of the recent pay raise for Con gress Page 32 Columns Jeffrey Hart notes that having fun is in style again on college campuses; Holmes Alexander reviews two pessimistic pessimistic reports on U.S. defense capabilities, awl Victor Riesel concludes that the Carter administration and big labor have establisheda working partnership Page 32 Tom Wicker sees the secret subsidies to King Hussein as evidence that the Central Intelligence Agency cannot be adequately controlled and Max Lerner profiles President Carter's new security adviser, Zbigniew Brzezinski Page 33 Tin: Indianapolis Star Published daily and Sunday by Indianapolis Newspapers, Inc., 307 N. Pennsylvania St., Indianapolis, Ind. 46206. with names like these at a price like this . . . what more can we say?",local,1977,2,indianapolis,indiana,midwest
1876303649,1966-09,Minneapolis Tribune (1964-1982),minneapolis,"It will exceed by a percept ihle margin the cost of living rise in 1956-57, our last period of major inflation.",local,1966,9,minneapolis,minnesota,midwest
1876304592,1966-01,Minneapolis Tribune (1964-1982),minneapolis,"S WHAT StOCKS 010 Mw rom n r tt irndnl f-i k dvnnit, ft-A3 petlinfl Unetianqfd . 27e. sessions Thtm 699 ttr 240 Total issue, 1475 Ne I9A4 hmhs 10J Now 1966 loot 10 14?6 103 13 Pnw June os Scrviie PlITSBl'KGH, Pa. Cm-( Cm-( ihle Steel Co. of America has been advised by Null mi Simon, a newlv elected dnec- ,(or and chairman of the fi- NEW YORK, N Y 'ti. metal committee, that Hunt j Fears of inflation and a mass-I'.mds mass-I'.mds Industries, Inc., jive return of the small in- ' plans to buv .it least 200,000 vestor to Wall Street accom- ' shares of Ciucible common 1 panied a rise to new highs stock either through purchase j in a turbulent stock market of c o n v c r t i h le preferred j session Friday. -hairs ,,r ummn sto, k. j Allhoilj,h the sPssion was Simon, who is chauman of ;9() minutes shorter than usual Hunt 1 oods' fm.iiice commit-; a handover from the now- tec also said the shares would set tied New York transit be in addition to those 1 hint j st nke volume soard to 0.18 foods holds in Ciucible.",local,1966,1,minneapolis,minnesota,midwest
1876216555,1965-11,Minneapolis Star (1947-1982),minneapolis,"However, in these days of mild but persistent inflation, inflation, the ratio is more likely to be 60-40, 60 per cent in stocks and only 40 per cent in savings accounts. accounts.",local,1965,11,minneapolis,minnesota,midwest
156454411,1970-05,Los Angeles Times (1923-1995),"los angeles, calif","Republicans are having an increasingly tough time explain- ing high interest rates, inflation and Situation Map rising unemployment.",local,1970,5,los angeles,california,west
119887627,1973-05,New York Times  (1923-),"new york, ny","BIG RISE IN PROFIT CONFIRMED BY  Before-Tax Net Estimated by Commerce Department at $113.1-Billion Rate RISE IN PERIOD IS 28% Inflation Pace Also Showed Advance Over Estimate, Climbing to 6.6% By EDWIN L. DALE Jr. Special to The New York Timea WASHINGTON, May 17 The Government confirmed to- day what private surveys had already  big increase in corporate profits in the first quarter of this year.",national,1973,5,new york,new york,northeast
1905855210,1970-02,Nashville Tennessean (1923-1972),nashville,"Fritchey: Black Trust, Et Al By CLAYTON FRITCHEY WASHINGTON - President President Nixon's highly E artisan explanations of why e hasn't been able to curb inflation, reduce crime, and gain trust of the Negroes, may not be convincing, but at least they are consistent: It's all the fault of Lyndon B. Johnson.",local,1970,2,nashville,tennessee,southeast
1905918972,1970-08,Nashville Tennessean (1923-1972),nashville,"""He was terribly put out with me personally, it appeared, appeared, when it became evident evident that the Congress intended intended to assert itself on what went into the tax bill, and not just endorse all of the schemes for stopping inflation and placating the rich then emanating from the White House . . .""",local,1970,8,nashville,tennessee,southeast
1867465633,1970-12,Courier-Journal (1923-) The,louisville,"In belated recognition of the situation, the administration has issued a second and stronger inflation , ""alert,"" which is a mis- nomer.",local,1970,12,louisville,kentucky,southeast
146134411,1974-10,Washington Post  (1974-) The,"washington, dc",Beyond the direct action of the government our private banking system has been manufacturing debt and inflation at a rate that not only staggers calculation but defies it.,national,1974,10,washington,district of columbia,northeast
148042177,1971-01,"Washington Post, Times Herald  (1959-1973) The","washington, dc","Indeed, Mr. Nixoh's steel jawboning, surprising even White House staffers in its intensity and speed, is no safeguard against inflation even if big steel finds it credible and acts accord. ingly.",national,1971,1,washington,district of columbia,northeast
1903235025,1975-02,St. Louis Post-Dispatch (1923-),st louis,"What a delicious way to help your family have f inland inland fight inflation, too!",local,1975,2,st louis,missouri,midwest
1821748208,1979-02,Detroit Free Press (1923-),detroit,Although there is reason for concern about loading up the tax laws with any more INFLATION QtuoH&ecVxcos AN INDEPENDENT NEWSPAPER JOHN S. KNIGHT Editor Emerltui RALPH S. ROTH President LEE HILLS Pubituher LEE E. DIRKS General Manager JOE H. STROUD Editor DAVID LAWRENCE JR.,local,1979,2,detroit,michigan,midwest
120211681,1975-02,New York Times  (1923-),"new york, ny","The cost increases                some  hat since the third quarter of 1974 when the inflation rate for highway building reached 3S p:r cent, a Federal  said, but asphalt  sold for S14 a ton is  .",national,1975,2,new york,new york,northeast
134325600,1979-02,Wall Street Journal  (1923-),"new york, ny","The previous efforts all were abandoned, often on the brink of success. and inflation accelerated ice again.",national,1979,2,new york,new york,northeast
747062013,1978-11,Boston Globe (1960-),"boston, mass","Italy heritage of change By Sari Gilbert Special to The Globe ROME The two middle-aged Americans both former servicemen from west of the Mississippi stood in lome s Plazza di Spagna and at the well-dressed affluent crowds the wellstocked shop windows and the glut of new and shiny cars The scene that spread before them -of traffic jams thriving restaurants crowds of tourists and joking Italian youngsters strolling arm in arm seemed out of place with recent press reports about Italy's terrorism university radicalism and inadequate social services But the most obvious disparity was with the Italy they had known in the closing days of the war and in the period immediately after low it s all changed said oneof the Yesagreed the other It sure was different then The last time the two had been in Rome was in early 1946, shortly after World War II had ended In thoe days most people were shabbily dressed Food was scarce the streets empty of traffic and nice girls wore high-necked blouses and skirts and were reluctant to go out on date without chaperone In those days the steps leading up to Trinita Doi Monti were bare of today s crowds of hippy-looking youngsters mostly long-haired and bearded boys or braless girls in scanty tops and tight-fitting jeans The scores of West European American and Japanese tourists had not yet arrived And Aldo Gucci's famous leather store in Via Condotti had not yet become the international mecca it is today Furthermore in those days the Vatican's presence was so strongly felt that most passing Italians knew that the squat massive building at the end of the piazza was the headquarters of Roman Catholic missionaries and the propagation of the Rooan Catholic faich Today for most it is just another palazzo Back then Italy had just emerged from 20 years of Fascism and from disastrous war begun by Bonito Mussolini that had left the country with the humiliating status of defeated nation For the last 35 years the country has been ruled by democratically elected parliamentary government From the start Italy's postwar leaders made point of seeing that their country was closely tied to the West and thoroughly integrated into the new political and economic institutional network that frustrated Europeans quickly began to build Back then with the Cold War just around the corner Communist-noncommunist hostilities seemed likely to bring the country to the point of civil war Today with the Communists' share of the national vote at close to 35 percent and their support essential for the survival of minority Christian Democratic government those fears have been largely overcome The newly elected president of the republic is former partisan and promi nent Socialist The president of the lower house of parliament the Chamber of Deputies is man who 30 years ago many Italians would have been inclined to call dirty red Back then however the major question on people s minds was now to avoid starvation and stay alive Other prime concerns were to rebuild the country s largely destroyed roads and railroads increase industrial production which had dropped 75 percent between 1938 and 1945, stop rampant inflation and find for the hordes of unemployed Today despite innumerable problems high inflation and unemployment among the young the country is enjoying European levels of prosperity Italy is now one of the world s 10 most developed nations with an annual per capita income of close to 4000 over 5000 miles of autostrade or expressways and with more than million new cars on the road each year Illiteracy has been almost totally eliminated The number of university graduates per year has tripled since 1963 ani 77 percent of high school graduates now go on to college The country has won universal recognition for its proficiency in design fash- ion and manufacturing of clothes shoes leather products office machines motor vehicles and food preserves It also ranks high on most foreign tourists lists 'today we are once again real country nation one can be proud of says Pietro Borga 68-year-old former shoemaker who remembers when coffee drinkers had to settle for brew made from barley when lower-income family could only dream of regularly eating beef and when summer vacations were only fantasies If the past is considered guess you could say we ve never or rarely ever had it so good said an Italian doctor who is annoyed by the tendency of the foreign press to write only of what doesn't work in Italy and to forget just how much progress has been made Purse-snatchings kidnapings political violence slow mails inflation and overcrowded schools and hospitals make good copy he says but they don't tell the story as whole And although Italians themselves tend to be persuasive pessimists whose favorite words are crisis and collapse the fact is that Italy has changed incredibly from the gloomy days of the late forties and the changes have brought with them both good and bad For example the massive immigration northward from the improverished south gave many Italians the possibility to -v both their earning power and their education It also placed an enormous strain on public facilities and social services that to this day has yet to be resolved causing semipermanent pockets of poetry and creating unfulfilled aspirations that inevitably led to an increase in crime The massive unionization that during the late fifties and early has guaranteed most workers and employees by Italian standards ad health and education But it also the cheap labor that together with American aid enabled the country to make speedy economic recovery and encouraged headstrong union leaders to resort to frequent and disruptive strikes that have made life difficult for visitors and many average Italians Government largesse and political patronage have provided jobs for many poorly skilled or unmotivated persons But the result has been and unwieldly central bureaucracy that often appears totally unequipped to deal with the day-to-day needs of modern industrialized country Left-wing pressures for greater social benefits have provided most Italians with free hospital drugs and medical care as well as with the chance to go to college as long as they have high school degree But there has been little planning to accompany these worthwhile aims with the result that hospital are overcrowded the public budget is deeply into the red and the country s teeming universities often appear to specialize in the creation of violence-prone intellectuals with little employment future Finally the 1948 constitution reintroduced the principles of democracy afters brutal dictatorship of more than 20 years But superimposed on country which for historical reason has had little sense of the state the system has ben transformed into one in which the patronage-heavy influence of Italy's political parties extends into almost every sector of life This means that party politics has been more concerned with ideological disputes and with power-sharing deals than with legislative work that world take prompt efficient action on nitty-gritty problems In fact sweeping reform bills regarding the police the bureaucracy pensions taxes universities and health that have been the parliament for years are still pending and there is little indication that passage or application tire now near Nevertheless other law that have been passed over the last 10 or 15 years have transformed Italy from family-oriented and church-controlled society to one much more in tune with developments in other parts of the West revised family law divorce and abortion have brought Italy to the Point of social says feminist lawver who believes that the recent laws have gone far in opening the door for the liberation ot Italy's largely culture- WVtOtei But insists conservative priest these innovations along with the open university policy that has flooded our colleges with political activists have alto had negative effects As in the unsuccessful church-sponsored antidivorce campaign of 1974. he attributed increased drug use continuing prostitution extensive political violence spreading pornography and growing dissemination of birth control information on laws leading to the dissolution of the family Certainly Italy today is like most 'other countries in the West not an entirely tranquil place Growing crime and sluggish courts have lead to overcrowded prisons Drug use is spreading among youths whose future is jeopardized by an economic recession and political with inaction and the mellowing of the once- Communist Party has frequently inspired thousands of youths to take to the streets preferring to the ballot or in the most extreme cases to team up with several clandestine terrorist groups Iecent years have not been easy for Italy and 1978 with the savage murder of former Prime Minister Aldo Moro made many Italians feel that the bottom had been reached But there is another side to Italy one which rarely gets into the headlines and which hasn't changed much since 1946 when reborn country drew itself out of the of the war This is the Italy made up of hundreds of thousand of people who work hard to earn living struggle to bring tip their children and hasten to lend hand to troubled neighbor or passerby This Italy was very much in evidence one recent Sunday when 200,000 people by no means all of them Catholic quietly turned up in Turin to attend public display of the holy shroud It is the Italy that still lays flowers daily on the spot where Moro's bullet-riddled body was found an Italy which in the words of veteran police man has great thirst for justice and very little taste for blood",local,1978,11,boston,massachusetts,northeast
532018769,1961-10,Afro-American (1893-),"baltimore, md",Does your Lnsurance cover your home s remodeling cost Many owners overlook an important step when they remodel or add to their home They aon t increase their house insurance to cover its new value Any house increases in property value approximately one per cent year during inflationary times IT IS GOOD idea then to have any home re-appraised every years to make certain the house has adequate insurance protection Since property increases in worth merely inflation re-modele house takes on substantially greater value THE INCREASED value of course depends on the type of remodeling done room addition modernized kitchen or converted attic are improvements that add worth to the property and give it greater resale value RE SIDING is another home modernization program that makes home more valuable and Insulating Siding is typical of the building materials used for this purpose It enhances the appearance of the house adds structural strength and deadens outside noises Because it is factory pre-finished and has high insulation value it decreases maintenance and fuel costs OR NOT you have remodeled it is wise to have the home appraised for its current market value It is then smart idea to increase your insurance to cover your added investment Remember it would probably cost you more to replace your home than the combined cost of its original purchase and the improvements you have made,local,1961,10,baltimore,maryland,northeast
1868059842,1974-12,Courier-Journal (1923-) The,louisville,"GI.OHV Sweeter Than Sugar Prices Southsidte Drive ot Southland Boulevaid for details 367-0164 'We're nere lo WAVE a flog againif inflation "" Every Kentuckiana family is eligible The only requirement requirement is approval of normal credit check Close tp Naval Ordnance, Harvester and Ford IMMEDIATE OCCUPANCY BARBS fo WW BcTa7eXoT-Teg-enbush Ln. large l bedronm aoartment, carpet, draoes, all aopliences, onlv $144 oer month. 2 bedrooms Yn baih also available, only $159 par month Jim Proud.",local,1974,12,louisville,kentucky,southeast
1821880007,1979-12,Detroit Free Press (1923-),detroit,Baker's scenario calls for only a moderate decline In inflation (and therefore a continuing continuing high level of long-term Interest rates).,local,1979,12,detroit,michigan,midwest
171238423,1974-12,Chicago Tribune (1963-1996),"chicago, ill","Of course, she is an extremely resourceful person, with several ways of  inflation.",local,1974,12,chicago,illinois,midwest
424016864,1980-11,New York Times,"new york, ny","And inflation, in turn, contributes to that dissolution.",national,1980,11,new york,new york,northeast
171827604,1979-01,Chicago Tribune (1963-1996),"chicago, ill","Deficits are merely an invitation to inflation, but unless the government prints extra money to pay its debts, the deficit won t cause an inflation.",local,1979,1,chicago,illinois,midwest
1868571376,1978-12,Courier-Journal (1923-) The,louisville,"""Accountants don't have responsibility responsibility for stemming inflation, but we do have the job of reporting it,"" says Connor, Connor, who speaks passionately about the subject.",local,1978,12,louisville,kentucky,southeast
172047922,1979-10,Chicago Tribune (1963-1996),"chicago, ill","a ""With inflation and recession at the same time, I don't know whether to raise or lower the price.""",local,1979,10,chicago,illinois,midwest
1889018364,1980-01,Cincinnati Enquirer (1923-),cincinnati,Inflation threatened the West big powers were suddenly at the mercy of the energy-rich.,local,1980,1,cincinnati,ohio,midwest
1878717706,1978-11,Minneapolis Tribune (1964-1982),minneapolis,"' The Labor Department announced stringent new standards Monday aimed at protecting 835,000 workers exposed to lead, a highly toxic and sometimes fatal substance. -i, The standard, which sharply reduces worker exposure to lead, Is likely to bring complaints from .President Carter's Inflation fighters.",local,1978,11,minneapolis,minnesota,midwest
1818277228,1960-12,Detroit Free Press (1923-),detroit,Inflation Changes Stocks BV WILLIAM A. DOYLE Q Preferred stocks and bends of good companies have always been recommended recommended aa sound long-term Investments.,local,1960,12,detroit,michigan,midwest
1878858093,1979-11,Minneapolis Star (1947-1982),minneapolis,Fuel Efficient Inflation Fighters Headquarters 1221 W.Lake St. (Near Henn.) (612)825-4441 mini!,local,1979,11,minneapolis,minnesota,midwest
293985128,1980-05,Boston Globe (pre-1997 Fulltext),"boston, mass","(""Bracket creep"" is the way the government assures itself of increased real revenues by taking greater proportions of earnings misleadingly boosted by inflation.",local,1980,5,boston,massachusetts,northeast
133952371,1974-04,Wall Street Journal  (1923-),"new york, ny","In earlier years, Inflation in the U.S. was eased somewhat because some of the demand created by 11.5. monetary and fiscal policy flowed overseas, helping to push up prices abroad.",national,1974,4,new york,new york,northeast
1902027422,1979-10,St. Louis Post-Dispatch (1923-),st louis,"John T. Connor, chairman of Allied Chemical Corp., said voluntary guidelines will have little impact on inflation unless the government continues to restrain the supply of money and federal spending.",local,1979,10,st louis,missouri,midwest
155820592,1967-09,Los Angeles Times (1923-1995),"los angeles, calif","With Canadians, a limited produc- tive capacity more quickly reveals the onrush of inflation.",local,1967,9,los angeles,california,west
1908245204,1980-01,Tennessean (1972-) The,nashville,"INFLATION FIGHTER Thomoson Ln. $150, 8803 fee 868-6330 METRO 383-097 DONELSON 2 bedrooms, car pets, hook-ups, $20 montn, 74- 4145 WEST 3 bedroom, carpets drapes kids-pets $15 bus METRO fee 383-097 FENCED FOR PETS Full basement 2 4 a den. $250.",local,1980,1,nashville,tennessee,southeast
157910602,1976-02,Los Angeles Times (1923-1995),"los angeles, calif","The minority Chris- tian Democrat government - ately began to tackle the country s ailing economy, underscored by the lira s record low of 805 to the dollar in unofficial trading, 7% unemploy- ment and 17%o inflation.",local,1976,2,los angeles,california,west
1888856605,1978-12,Cincinnati Enquirer (1923-),cincinnati,The wage-and-price guidelines are aimed at holding inflation next year to a 6.5 annual annual rate.,local,1978,12,cincinnati,ohio,midwest
169610734,1977-09,Chicago Tribune (1963-1996),"chicago, ill","He said the  were based on the understanding that ""inflation does not affect the clergy to the same extent as it does the laity because provision is made for our room and board.""",local,1977,9,chicago,illinois,midwest
1821770613,1979-03,Detroit Free Press (1923-),detroit,"Moreover, Fraser said, the plan fails to deal adequately with ""runaway inflation"" in the health-care sector of the national economy. economy.",local,1979,3,detroit,michigan,midwest
1888092479,1969-11,St. Louis Post-Dispatch (1923-),st louis,The outcome was a significant victory for President Richard M. Nixon in the early voting on disputed issues in the big bill. Mr. Nixon had said the ex-tention ex-tention was necessary to provide provide revenue for the remainder of the current fiscal year and thus contribute to the burget surplus that he is planning as part of the fight against inflation. inflation.,local,1969,11,st louis,missouri,midwest
