file_id,year_month,title,loc,text,scope,year,month,city,state,region
1901945806,1979-04,St. Louis Post-Dispatch (1923-),st louis,"Proxmire said a decision now to balance the budget would have a great psychological effect, sending out ""one clear unmistakable signal that this government means business about inflation.""",local,1979,4,st louis,missouri,midwest
147118264,1979-01,Washington Post  (1974-) The,"washington, dc","To some analysts, the wheel-spinning Carter did in his first two years in office only made inflation more difficult to deal with.",national,1979,1,washington,district of columbia,northeast
1868546929,1978-07,Courier-Journal (1923-) The,louisville,The principles would require that any national health plan reduce health costs and help fight inflation generally.,local,1978,7,louisville,kentucky,southeast
158976652,1979-08,Los Angeles Times (1923-1995),"los angeles, calif","While income redistribution and non-indexed taxes are the problems I see associated with our in- flation, the public s hue and cry about inflation ap- pears to have little to do with these issues.",local,1979,8,los angeles,california,west
1878751006,1979-02,Minneapolis Tribune (1964-1982),minneapolis,"Carter has proposed an ""austere"" budget to reduce the federal deficit in 1980, saying that will help control inflation.",local,1979,2,minneapolis,minnesota,midwest
123791109,1978-03,New York Times  (1923-),"new york, ny","Granted, as you say, that state aid to cities and towns in Connecticut has increased at a much slower rate than inflation, do you suggest that it should be at the same rate or more?",national,1978,3,new york,new york,northeast
146877609,1978-10,Washington Post  (1974-) The,"washington, dc","The inflation package also drew support from Federal Reserve Chairman G. William Miller, who described it as a ""balanced, concerted and sustained program to fight inflation"" in a speech Wednesday night.",national,1978,10,washington,district of columbia,northeast
119836657,1973-07,New York Times  (1923-),"new york, ny","A TOUGH  PROGRAM New Regulations Go Into Effect Aug. 12 in Other Sectors By EDWARD COWAN Sprclul to Ille New York frames WASHINGTON, July 18 President Nixon ended the freeze today on prices for health care and food, except for beef, as he out. the fourth phase of his 23-monthold effort to combat price and wage inflation.",national,1973,7,new york,new york,northeast
123295513,1977-08,New York Times  (1923-),"new york, ny",What bothers these critics is that the uncertainty connected with floating rates raises the cost of doing business abroad; they also charge that floating rates make it more difficult to contain word inflation.,national,1977,8,new york,new york,northeast
158818195,1979-01,Los Angeles Times (1923-1995),"los angeles, calif","Three  ago, I  a  anu- inflation program that couples responsible government restraint with responsible wage and price restraint It is based upon my knowledge that there is a more powerful force than government compul- sion-the force created by the cooperative efforts of millions of Americans working toward a com- mon goal.",local,1979,1,los angeles,california,west
1888370381,1969-10,Cincinnati Enquirer (1923-),cincinnati,Inflation Is probably the main reason for the dearth of bodies In many cocktail lounges and nightspots.,local,1969,10,cincinnati,ohio,midwest
121129569,1980-02,New York Times  (1923-),"new york, ny",But individually they don't constitute inflation.,national,1980,2,new york,new york,northeast
158467831,1977-12,Los Angeles Times (1923-1995),"los angeles, calif","""I'm not a big bear on the inflation outlook,"" Warner adds, ""it s just that I don't see any reason for improve- ment.""",local,1977,12,los angeles,california,west
1820867248,1976-09,Detroit Free Press (1923-),detroit,"Too late, bank officials discovered that the German 100,000-mark note Holcomb had given them was completely worthless, printed during the peak of Germany's post-World War I inflation.",local,1976,9,detroit,michigan,midwest
148409678,1973-06,"Washington Post, Times Herald  (1959-1973) The","washington, dc","Government, inflation        ers had been watching the I Teamster talks closely.",national,1973,6,washington,district of columbia,northeast
146098494,1974-12,Washington Post  (1974-) The,"washington, dc","Craig said in a telephone :ir/.] terview. ' ,.:i.;i , ,""] State highway :diter/ Douglas B. Fugate.,: three weeks ago that inflation, lower than expected tax collections and the fast pace of road construction in recent months have depleted road building funds to the poin t that a moratorium on new contracts is necessary.",national,1974,12,washington,district of columbia,northeast
1888931340,1979-02,Cincinnati Enquirer (1923-),cincinnati,Flnan's argument is that state spending only feeds inflation and makes it worse.,local,1979,2,cincinnati,ohio,midwest
1892908411,1974-02,Indianapolis Star (1923-),indianapolis,"For example, a 19 per cent rate of inflation would double the cost of living in four years.",local,1974,2,indianapolis,indiana,midwest
1901124574,1971-04,St. Louis Post-Dispatch (1923-),st louis,"In a speech to the fifty-ninth annual meeting of the United States Chamber of Commerce, Mr. Nixon took issue with some private economists who had said that Administration policies policies had made little progress in curbing inflation.",local,1971,4,st louis,missouri,midwest
1901452274,1973-01,St. Louis Post-Dispatch (1923-),st louis,"In addition to the problems of inflation and unemployment, the nation's international financial accounts are badly out of balance.",local,1973,1,st louis,missouri,midwest
1910780976,1980-03,St. Louis Post-Dispatch (1923-),st louis,"Also near Lambert, construction is planned for a nine-story, 179-room addition to the Marriott Hotel, for a new 600-room motel by the Breckenridge Hotels Corp. and for a 63-unit motel to be known as the Oakland Park Inn. projecting at the very minimum a 10 percent annual inflation rate over the next five years.",local,1980,3,st louis,missouri,midwest
158170736,1977-03,Los Angeles Times (1923-1995),"los angeles, calif","With capital goods prices rising at 4.7% in 1976, the 1977 capital spend- ing estimate represents a projected real increase of about 7% assuming the same inflation rate.",local,1977,3,los angeles,california,west
1892921897,1974-07,Indianapolis Star (1923-),indianapolis,"Temp TopRale No tee e.lS1094 SECRETARY-RECEPTIONIST"" Filing shorthand end typing experience. experience. 2S7-5UM. 5?5 Fmpfoymenf SECRETARY TYPIST INFLATION"" WHO CARES?",local,1974,7,indianapolis,indiana,midwest
147241684,1980-02,Washington Post  (1974-) The,"washington, dc","Presumably, what elected Bani-Sadr president was widespread hope that as an economist he would be well equipped to cope with the country s terrible problems of inflation, unemployment and food shortages.",national,1980,2,washington,district of columbia,northeast
1878184345,1974-05,Minneapolis Tribune (1964-1982),minneapolis,"With current tax rates and the known spending programs, including including a large prospective prospective increase in defense spending, the surplus would be more than $90 billion by 1980 if inflation proceeds at an average rate of 5 percent a year.",local,1974,5,minneapolis,minnesota,midwest
275820918,1961-09,Boston Globe (1960-),"boston, mass",The spur to keep up with inflation has hiked sales.,local,1961,9,boston,massachusetts,northeast
170300850,1972-06,Chicago Tribune (1963-1996),"chicago, ill","After delays caused by a taxpayers suit, la- bor strikes, and Inflation, the cost ex- ceeded expectations-with the result that the legislature added an extra one- half cent to the sales taxes in the coun- ties for additional financing.",local,1972,6,chicago,illinois,midwest
120216106,1975-12,New York Times  (1923-),"new york, ny","The former President's secrecy about the war buildup and the related delay in tax policy, according to critics, started the nation down the road to troublesome inflation.",national,1975,12,new york,new york,northeast
1893413529,1979-06,Indianapolis Star (1923-),indianapolis,"Kahn told the subcommittee: ""The OPEC increases yesterday (Wednesday) raise the real specter that we will be bumping at double-digit inflation for the rest of this year.""",local,1979,6,indianapolis,indiana,midwest
1901694386,1976-01,St. Louis Post-Dispatch (1923-),st louis,More Company officials say that these increases are necessary because of continuing inflation and higher employe wages.,local,1976,1,st louis,missouri,midwest
133204219,1967-08,Wall Street Journal  (1923-),"new york, ny","German Wages Leveling But Contract Demands Are Due in Second Half Gains in First Six Months Were Down From the Previous Year, And Are Termed 'Moderate' By a WALL STREET JOURNAL Staff Reporter COLOGNE, West Germany--Wage costs in West Germany are leveling, strengthening hopes of some industrialists that the country s period of wage inflation may have ended, but businessmen cross fingers since a wave of wage demands must be faced in the second half.",national,1967,8,new york,new york,northeast
1833590160,1971-05,Detroit Free Press (1923-),detroit,The Bast Inflation-Fighter 01 All!,local,1971,5,detroit,michigan,midwest
1836481313,1975-10,Detroit Free Press (1923-),detroit,"T - V iuJAJ ""Samuelson may be a Nobal prlze-wlnnlng prlze-wlnnlng economist, but so Is F.A. Von Hayek, and he expects much worse Inflation than I'm predicting.""",local,1975,10,detroit,michigan,midwest
1903252264,1975-05,St. Louis Post-Dispatch (1923-),st louis,"No Cause For Fear Recession and inflation have combined to take their toll on the Social Security system, as they have on almost everything else, with the result that in the next fiscal year expenditures will exceed income by about 3 billion dollars.",local,1975,5,st louis,missouri,midwest
134466161,1980-02,Wall Street Journal  (1923-),"new york, ny","The move :d help offset the ""wide :~read impression that the Fed hasn't beer, as          as i3 should Se in  inflation. says John L Eytattt, executive vice president for 9nance and 2  of American Standard Inc., a maker of tra9 and building products and             and mining equipment.",national,1980,2,new york,new york,northeast
132615663,1961-12,Wall Street Journal  (1923-),"new york, ny","General Flsenhrtu or hus accepted the honorary of an anti-Infiatlonary group know an the Council for N:conomic Growth and Security, Inc. Dr ,lames Tobin of the Freside nt s Conncll of Advisers says he s having thoughts on the desirability of creeping inflation.",national,1961,12,new york,new york,northeast
1868512307,1978-06,Courier-Journal (1923-) The,louisville,Current economic theory views the balance between inflation and unemployment unemployment as a trade-off.,local,1978,6,louisville,kentucky,southeast
655247711,1976-01,Boston Globe (1960-),"boston, mass","Asked to cite his biggest disappointment since taking office, Mr. Ford said it would have to be his frustration at being unable to ""turn a switch"" and conquer both inflation and unemployment.",local,1976,1,boston,massachusetts,northeast
115648267,1964-01,New York Times  (1923-),"new york, ny","Careful economic planning has maintained over-all !stability despite some inflation and budget imbalance, and private capital, both foreign and domestic, is di-awing up important expansion plans.",national,1964,1,new york,new york,northeast
123170753,1977-12,New York Times  (1923-),"new york, ny","MEXICO CITY, Dec. 16 The Mexican Government plans a cautious relaxation of its austerity program next year, allowing the economy to grow by about 5 percent but still maintaining its fight against inflation.",national,1977,12,new york,new york,northeast
121266770,1980-12,New York Times  (1923-),"new york, ny","They burble enthusiastically about housing stability, a good investment, a hedge against inflation and future resale possibilities for their apartments.",national,1980,12,new york,new york,northeast
132706624,1961-02,Wall Street Journal  (1923-),"new york, ny","Growth, by the prevailing line of reasoning in the capital, poses a t o-fold demand for Federal planning of Deterring Inflation Ofticinl9 are quite that spurting C:uve_rnment plus recovery plus .v toward toll and full tail inevitably tempt price rises: it is deemed vital to deter many of them 12h tht, new array of techniques But while planned to counted upon as a way to a or control the of gro th, it is simultaneously rated a chief instrument for accomplishing that growth The pi Ice of long-term money must be brought down, by the Treasury's handling of its o n borrowings, by cooperative Federal Resen e System maneuvers tn the credit markets, by policies of the agencies, and by whatever other means seem suitable-to spur a rush of burro ing, spending, building, producing f But the price of short-term money mast be kept from falling, to keep portable capital from fleeing to more profitable foreign markets.",national,1961,2,new york,new york,northeast
120713270,1979-09,New York Times  (1923-),"new york, ny","These services and subsidies were beyond the state s fiscal capability and were in the long run self-defeating, as they contributed to increased inflation.",national,1979,9,new york,new york,northeast
1876578463,1968-03,Minneapolis Tribune (1964-1982),minneapolis,Two immediate steps against medical inflation recommended recommended by Mr. Johnson would need congressional approval. approval.,local,1968,3,minneapolis,minnesota,midwest
1884182379,1960-02,Cincinnati Enquirer (1923-),cincinnati,"""We are in a crisis of inflation which steadily saps the earnings ana savings of our people.",local,1960,2,cincinnati,ohio,midwest
1878312688,1974-09,Minneapolis Star (1947-1982),minneapolis,"Though few but the fanatic take devolution devolution seriously, it provides a little relief from the endless discussion of inflation, government crises, the coming election, the sagging economy and falling share prices.",local,1974,9,minneapolis,minnesota,midwest
1878259478,1974-08,Minneapolis Tribune (1964-1982),minneapolis,SILVER BULLION From Liberty Metals Financial protection against worsening worsening Inflation from a company with lofty Ideas about why you deserve an edge of our deleriorating economy.,local,1974,8,minneapolis,minnesota,midwest
148429224,1973-07,"Washington Post, Times Herald  (1959-1973) The","washington, dc","The basic tenet of the populist credo is that THEODORE J. JACOBS is executive director of the Center for Study of Responsive Law in Washington. economic concentration causes and perpetuates many of our domestic problems, including everyday ills such as inflation and overpricing.",national,1973,7,washington,district of columbia,northeast
1820467742,1974-12,Detroit Free Press (1923-),detroit,"Inflation Tide Ebbing, Commerce Chief Says BY DAVID KLEMENT Free Press Business Writer The current economic slump ""has several months to run"" but it appears that ""the back of inflation has been broken,"" Commerce Secretary Frederick B. Dent said in Detroit Detroit Monday.",local,1974,12,detroit,michigan,midwest
123951830,1979-10,New York Times  (1923-),"new york, ny","But such perceptions do not dawn on those whose polemical purpose is to exploit a scare number in order to scapegoat ""over-regulation"" for inflation, unemployment, and the decline of the dollar, innovation, productivity and the Chrysler Corporation.",national,1979,10,new york,new york,northeast
120776335,1979-08,New York Times  (1923-),"new york, ny","A Million Workers Struck Briefly Last Week A Million Workers Struck Briefly Last Week Inflation Presents a Threat To Begin Regime's Future By DAVID K. SHIPLER JERUSALEM--Prime Minister Menachem Begin may have won a Nobel Prize for peace, but most Israelis wouldn't give him the prize for economics.",national,1979,8,new york,new york,northeast
117665817,1966-11,New York Times  (1923-),"new york, ny","Slowdown Called 'Healthy' He noted that different persons, both inside and outside the Government, were reading recent economic statistics in different ways, with some reaching the conclusion that the business boom and inflation will continue and others concluding that they will not.",national,1966,11,new york,new york,northeast
1893053956,1976-07,Indianapolis Star (1923-),indianapolis,"As the nations gain strength again, ""inflation remains worrisome,"" said the department.",local,1976,7,indianapolis,indiana,midwest
1868026623,1974-01,Courier-Journal (1923-) The,louisville,"Like 94 of the 100 biggest earners on a list published by the National Tax Bureau, Han is in the real-estate business, a tribute to the enormous inflation in the land prices in this crowded island country.",local,1974,1,louisville,kentucky,southeast
1888675370,1975-12,Cincinnati Enquirer (1923-),cincinnati,"U is utilization, I is inflation jrXlS You and I are paying the bill.",local,1975,12,cincinnati,ohio,midwest
120570912,1975-04,New York Times  (1923-),"new york, ny","Also reflecting current Ilfestyles and the ""economic climate,"" according to Mr. Levine, were a series of ""inflation "" rooms, ranging in price from $2,100 for a patio, and $2,500' for a bedroom, to $12,000 for a split level living/dining room.",national,1975,4,new york,new york,northeast
1819014352,1965-03,Detroit Free Press (1923-),detroit,"As for silver as a hedge against inflation, it ranks well down on the list of traditional hedges.",local,1965,3,detroit,michigan,midwest
1878497271,1976-03,Minneapolis Star (1947-1982),minneapolis,"He had pointed out that In his area man"" families had $.001 incomes incomes and homes that inflation had made worth $25,000.",local,1976,3,minneapolis,minnesota,midwest
158531471,1978-04,Los Angeles Times (1923-1995),"los angeles, calif","But an energy price rise in the short run would help to stabilize the dollar and to reduce U.S. dependence on imported oil, he said, so that it would have a ""stabilizing"" influence on the inflation rate, On other issues, Blumenthal said: -Unemployment, at 6.1% in Feb- ruary, will ""continue to fall gradually.",local,1978,4,los angeles,california,west
569250670,1974-01,New Journal and Guide (1916-),"norfolk, va","The summing-up for the past 12 months produced lugubrious litany of political corruption inflation fuel shortages and assorted other crises foreign and domestic BEFORE WE sink too deeply in 1974, we need to be reminded that 1973 was not as villainous as it has been pictured For unless the prevailing impression is changed before it hardens 1973 will acquire permanent stigma of the type that sullies the good name of 1929.",local,1974,1,norfolk,virginia,southeast
169312030,1974-08,Chicago Tribune (1963-1996),"chicago, ill","In the last 10 years expenditures for food away from home, expressed in constant dollars [adjusted for inflation], in- creased by 31.5 per cent.",local,1974,8,chicago,illinois,midwest
1877562777,1971-01,Minneapolis Tribune (1964-1982),minneapolis,"Also inflation, unemployment, unemployment, race relations, generation generation gaps, hair of all lengths, and politicians and psychiatrists of all kinds.",local,1971,1,minneapolis,minnesota,midwest
158663441,1978-10,Los Angeles Times (1923-1995),"los angeles, calif","The council said the underlying rate of inflation-meaning that vola- tile changes in food and energy prices had not been counted-increased to more than 7% at an annual rate in calendar 1978, up from 6% last year.",local,1978,10,los angeles,california,west
1876306256,1966-09,Minneapolis Tribune (1964-1982),minneapolis,"Gullander, president of the NAM, testified that in fighting inflation ""the principal principal effort must be on the side of reducing government spending.""",local,1966,9,minneapolis,minnesota,midwest
134293599,1978-02,Wall Street Journal  (1923-),"new york, ny","This happened, as the chart shows. between 1965 and 196t, a time of economic expansion but also accelerating inflation.",national,1978,2,new york,new york,northeast
119378577,1971-03,New York Times  (1923-),"new york, ny","The recent change in Government policy, from fighting inflation to reducing unemployment, is self-evident.",national,1971,3,new york,new york,northeast
424013993,1980-11,New York Times,"new york, ny","While his advisers say they would be ''modest,'' perhaps not more than $20 billion above Mr. Carter's figure in 1985  when inflation assumptions are equalized, the Carter team says that Mr. Reagan has already promised so many new defense items that spending would have to grow  rapidly.",national,1980,11,new york,new york,northeast
134476989,1980-02,Wall Street Journal  (1923-),"new york, ny",What's News Business and Finance Spending cuts by the government appear more likely as a response to soaring inflation.,national,1980,2,new york,new york,northeast
1893013480,1975-12,Indianapolis Star (1923-),indianapolis,"""To cushion workers against the effects effects of inflation, unions are expected to demand not only 'normal' wage increases, increases, but also catch-up wage boosts and escalator clauses in their contracts;"" contracts;"" the board said in a summary of the Forum survey findings used for the 1976 forecast.",local,1975,12,indianapolis,indiana,midwest
158342261,1977-07,Los Angeles Times (1923-1995),"los angeles, calif","""As a policy matter, we are not faced with a choice between compet- ing alternatives, but rather with a straightforward imperative to fight inflation if we want to conquer unem- .""",local,1977,7,los angeles,california,west
294017470,1980-11,Boston Globe (pre-1997 Fulltext),"boston, mass","""If the public thinks high inflation is here to stay, we're going to have a tough time,"" Matz said in a recent interview.",local,1980,11,boston,massachusetts,northeast
119897307,1973-05,New York Times  (1923-),"new york, ny","The structure of the speech compresses into a single sentence: ""Although it is clearly unreasonable that I as Presidentlaboring full-time to bring peace to our generation and to combat inflation and to make it safe to walk the streets at  be held responsible for the excesses and minor illegalities of the entire execu- tive and political staffs, nevertheless, because I am that hind of man, I do accept responsibility, and commence my discharge of it here tonight by tiring two innocent men.""",national,1973,5,new york,new york,northeast
1888350107,1969-01,Cincinnati Enquirer (1923-),cincinnati,"President Nixon, like Britain's Britain's labortie Harold Wilson, Wilson, will use tight money to create some unemployment unemployment to cool off overheated inflation.",local,1969,1,cincinnati,ohio,midwest
1892774189,1972-03,Indianapolis Star (1923-),indianapolis,It shatters the myth that Communist economic planning rules our inflation.,local,1972,3,indianapolis,indiana,midwest
169941242,1971-07,Chicago Tribune (1963-1996),"chicago, ill","Cost of Living Rise at 15-Month High BY LOUIS  [Chicago Tribune Press Service] WASHINGTON, July 23-Dr. Arthur F. Burns, chairman of the Federal Reserve Board, to- day endorsed President Nixon's decision to step up the fight against inflation, rather than stimulate the national economy to cut unemployment.",local,1971,7,chicago,illinois,midwest
147163737,1979-01,Washington Post  (1974-) The,"washington, dc","""The corrosive effects of inflation eat away at the ties that bind us together as a people,"" said President Carter Thursday in the third of the messages -- the budget, the State of the Union, and the Economic Report -- that make up the traditional January triad.",national,1979,1,washington,district of columbia,northeast
170125095,1980-03,Chicago Tribune (1963-1996),"chicago, ill",Remember some of those shocking Continued an page 2 How to beat inflation: Spend now Continued from page 1 prices I mentioned at the outset?,local,1980,3,chicago,illinois,midwest
162985298,1980-12,Los Angeles Times (1923-1995),"los angeles, calif","When the salaries are compared to inflation, howev- er, the study found that faculty at both the University of California and the state college system now earn 3.2% less than in 1974-75 in ""real dollars.""",local,1980,12,los angeles,california,west
170042410,1979-12,Chicago Tribune (1963-1996),"chicago, ill","Besides, some say, when inflation gets into double figures, 2 per cent or 3 per cent shrinks in significance.",local,1979,12,chicago,illinois,midwest
1888418214,1970-11,Cincinnati Enquirer (1923-),cincinnati,"We have filed for the increase so that we can assure adequate earnings to attract investors investors in a money market which, like everything everything else, has felt the impact of inflation.",local,1970,11,cincinnati,ohio,midwest
1886755072,1960-08,St. Louis Post-Dispatch (1923-),st louis,"He said inflation was every American's problem and that the nation's economic, military and spiritual strength depended on solving it.",local,1960,8,st louis,missouri,midwest
423975152,1980-09,New York Times,"new york, ny",He expects double-digit inflation to return within a year.,national,1980,9,new york,new york,northeast
1888915101,1979-03,Cincinnati Enquirer (1923-),cincinnati,"""We should have a list In two weeks of things that are feasible that make sense"" in the effort to slow Inflation of food costs, Kahn told the Senate Budget Committee.",local,1979,3,cincinnati,ohio,midwest
