id	text	month	year	assigned
3206535	A Fed that strictly targeted inflation would have to tighten monetary policy to keep inflation from rising -- but at the cost of causing the real economy , already hit by that shock , to contract further .	4	2015	mh*
8844432	"Even so , he added , the RBA will be looking at other countries and "" what you are seeing elsewhere is inflation expectations have dropped pretty quickly . """	5	2016	mh*
3356997	""" If you look at the long-term trend , college tuition has been rising almost six percent above the rate of inflation , "" said Ray Franke , a professor of education at the University of Massachusetts , Boston . """	6	2015	mh*
2449867	""" My whole reason for investing in real estate is to be a hedge for inflation , "" he said . """	4	2014	mh*
7938692	This reflects several factors : signs that the economy remains on track and the recovery in financial conditions ( i.e. less downside risk ) , as well as stronger than expected inflation .	3	2016	mh*
88029437	"Among developed economies , the U.S. , the U.K. , Canada , and Australia "" are more at risk of sustained higher inflation , "" Goltermann wrote in a note Thursday ."	9	2021	mh*
2634438	In addition , to reach this inflationary stage , there must be some sort of energy to drive the inflation .	7	2014	mh*
7368361	Policy makers are still able to reach their medium-term inflation goal under the central bank 's base case , according to Nabiullina .	2	2016	mh*
70077058	Put differently , crypto 's rise in Venezuela is n't just about inflation or capital controls , but also about entrepreneurship and evangelism .	9	2018	mh*
255908	After reaching more than 10 percent in 2011 , consumer price inflation in sub-Saharan Africa dropped to 7.9 percent at the end of 2012 ( see Chart 2 ) .	5	2013	mh*
87154901	If you think inflation poses a long-term threat , you might want to make these portfolio moves now  Shift bond exposure , add gold and other commodities , and look for dividend increases in the stock market .	5	2021	mh*
31547520	Officials were also concerned that inflation still had n't reached the Fed 's target level of 2% .	1	2020	mh*
227185	The point is to drive up annual inflation to a target of 2% .	4	2013	mh*
7269557	"Core inflation is not our objective , but it tends to lead headline inflation over the medium-term . """	1	2016	mh*
3821173	"BUT PRESSURES NOT YET AT APPROPRIATE LEVEL FOR RATE RISE  "" But the cost price pressure to date is not yet sufficient to be consistent with inflation heading back towards the 2 percent target ."	11	2015	mh*
89001555	OUR NEXT LOOK AT INFLATION COMES THE SECOND WEEK IN APR .	3	2022	mh*
14496155	"On the "" Fed side , you need to have a central bank that would actually have a hiking cycle that would signal three to four hikes a year , and that would depend heavily on what happens with inflation , "" he said ."	9	2016	mh*
95647349	"Though inflation is decelerating , it 's still "" very elevated "" and over three times greater than the ... + Fed 's 2% target , one expert notes ."	12	2022	mh*
82969249	quote:Adjusted for inflation , monthly regimen of insulin was around $450  Your own link says ...  quote:According to the American Diabetes Association between 2003 and 2012 the price of insulin in the U.S.A tripled .	12	2019	mh*
3538794	Jack Blackstone  Inflation bro .	8	2015	mh*
81045929	Most universities and community colleges would n't get enough of a funding hike to cover inflation under the latest budget plan in the Michigan Legislature .	9	2019	mh*
9427094	Mr. Rajan , who became Reserve Bank of India governor in September 2013 , has overseen a drop in inflation , and speedier economic growth , as India has become the world 's fastest-growing large economy .	6	2016	mh*
32980286	That means inflation will go up in various regions .	6	2021	mh*
25848608	If the second quarter 's growth rate continues , it could risk accelerating inflation and prompt the Fed to raise rates more quickly .	7	2018	mh*
2310232	Monetary Policy Options and Tools  In light of elevated unemployment and low inflation , monetary policy needs to remain highly accommodative .	2	2014	mh*
88058316	Some Some one-off one-off factors factors accounted accounted for for the the record record jump jump from from July July but but the the BoE BoE thinks thinks inflation inflation is is heading heading above above 4% 4% , , more more than than double double its its 2% 2% target target . .	10	2021	mh*
70138620	Consumers have had steep declines in near-term inflation expectations recently , but October 's preliminary report actually saw an increase to 2.8% from 2.7% for expectations for next year .	10	2018	mh*
3824509	About 55 percent is due to inflation , and the other 15 percent has one culprit -- the beloved steak .	11	2015	mh*
83774594	According to a report by the Urban Land Institute cited in the article , housing prices in Texas are now rising faster than inflation , population growth , and income growth .	2	2020	mh*
84767002	The March report showed that an inflation gauge closely followed by the Federal Reserve dropped 0.3% in March and is up 1.3% from a year ago , well below the Fed 's 2% target for inflation .	4	2020	mh*
87588887	Homeownership -- although expensive and for many Americans , unaffordable or unappealing -- as a means of inflation protection only works if the owners intend to stay in their houses for the next decade or so , said John Scherer , a certified financial planner and founder of Trinity Financial Planning .	7	2021	mh*
88893310	The company noted that year-over-year second half financial performance is expected to improve as recent pricing actions will be fully reflected in market with better mitigation of inflation with pricing , and strong levels of demand , while supply and labor conditions improve .	3	2022	mh*
89555602	But of course , you still see another very significant 14% jump in inflation , and slowly but surely , hopefully will continue to improve on the supply chain side .	6	2022	mh*
85323274	""" Real ( inflation-adjusted ) gross domestic product ( GDP ) is expected to grow at a 12.4 percent annual rate in the second half of 2020 and to recover to its prepandemic level by the middle of 2022 , "" the report said ."	7	2020	mh*
31622791	Thanks to inflation , the value of money erodes over time .	2	2020	mh*
86897551	Healthcare Healthcare and and rents rents will will determine determine the the inflation inflation path path . .	3	2021	mh*
3333542	A study by the International Monetary Fund found that El Nino typically adds between 0.5 and 0.9 percentage points to inflation in India , Indonesia and Thailand .	6	2015	mh*
2008981	Adjust for inflation .	12	2013	mh*
8218543	"The Nikkei manufacturing PMI fell to 49.1 in March , the lowest since February 2013 , and Japanese households ' inflation expectations have fallen to a three-year low . """	4	2016	mh*
9435093	Real history requires recalling what happened in 1970s Britain , the last time the U.K. stood outside an imperial trading zone and outside an integrated European market : stagnation and inflation , three-day working weeks , and endless strikes .	6	2016	mh*
88788999	"Zelnick notes that the slowdown in Government and Commercial revenue , coupled with "" contribution margin compressi  The release on Wednesday of the minutes of the Federal Reserve 's last policy meeting is likely to shed light on the U.S. central bank 's plans to trim its massive balance sheet and hike interest rates in 2022 as well as update its shifting view of inflation ."	2	2022	mh*
25570003	UK house prices rise for second month running , says Halifax  Read more  The new zero inflation target would mean house prices falling by around 10% in real terms as wages continue to rise , the thinktank said , making homes more affordable .	7	2018	mh*
26149137	Sharply higher energy prices saw Canadian inflation unexpectedly spike in July .	8	2018	mh*
86742022	The fact that digital currencies are protected from inflation , capital controls , or exchange rate depreciation has seen many Nigerians turn to them for financial trades such as cross-border remittances and e-commerce .	2	2021	mh*
17164574	"They cited strengthening economic activity , a growing job market and signs that inflation "" was likely to be close to 2% in the near term . """	2	2017	mh*
92266709	Western sanctions aimed at crippling major energy producer Russia have resulted in sharply higher fuel costs in Europe and the United States , with inflation soaring as a result .	7	2022	mh*
15417154	If the rate is high , inflation could start to rise even while a large number of people are unable to find work .	11	2016	mh*
8666299	I determine the equity risk premium by using the following formula : ERP = D* ( 1 + G ) / P + G -- Rf , where D is levered free cash flow ( unlevered free cash flow minus interest expense plus debt increase ) , G is the terminal growth rate ( the average of the projected inflation rate and long-term GDP growth ) , P is the market value of equity , and Rf is the risk-free rate ( ten-year treasury bonds ) .	8	2019	mh*
18308275	Under the lid , the amount of additional money the city is allowed to collect without getting voter approval is generally limited to the five-year average rate of inflation , likely to be about 1.5 percent .	5	2017	mh*
128634	In fact , the cost of treating diabetes is actually rising slower than health care inflation in general .	3	2013	mh*
70754288	Bret : Meanwhile , there 's the news that unemployment is at 3.6 percent , a 50-year low , wage growth is solid , inflation is low , and growth is robust .	5	2019	mh*
88966546	The Markit March PMIs are do for the major developed economies , and the insight around inflation and Ukraine will prove critical ... if not fully market moving .	3	2022	mh*
738247	Some households will remain trapped , missing out on better jobs elsewhere , waiting for inflation and monthly payments to slowly grind away the debt .	2	2012	mh*
87106468	Robert Lee -- KBW -- Analyst  Great , thanks , goodmorning , hope everyone is doing well .. Just maybe a follow-up in a way to the inflation question because with inflation usually comes higher rates .	4	2021	mh*
22657982	"The back end is really well contained , just based on underlying growth dynamics and the lack of inflation coupled with the continued need for yield , "" he said ."	1	2018	mh*
3446908	If there is increasing volatility with the inflation rate , the RBI will have to use the repo rate to counter .	7	2015	mh*
85105119	Constructed of heavy gauge PVC , the Lob The Blob features a speed safety valve for fast and easy inflation and deflation as well as grommets on all four corners to make tethering a breeze .	6	2020	mh*
63165141	A bit of inflation can be a good catalyst to get a consumer o ?	7	2021	mh*
62914848	A strong read could fuel calls for the FOMC to end its blindness to rising near-term inflation .	5	2021	mh*
90160903	late they work in trying to inflation .	11	2022	mh*
935325	Finally , German taxpayers will be suffering unacceptable inflation and an apparently uncontrollable looming bill to bail out their euro partners .	5	2012	mh*
2547719	That said , nominal income targeting does allow for persistent deviations of inflation from target , which may undermine the anchoring of expectations .	6	2014	mh*
81394821	Mr. Evans expects the jobless rate to stay at a level just under 4% and he sees inflation slowly moving up to the central bank 's 2% target over the next several years .	10	2019	mh*
84410420	The U.S. Federal Reserve is pumping money into the economy and has slammed interest rates to near zero again , factors that can lead to inflation when the economy heats back up .	3	2020	mh*
85915976	In the wake of the Great Recession , two percent has been the Fed 's target for core inflation .	9	2020	mh*
2978506	Let 's assume a 1 percent inflation rate for 2015 and use , then , a 1 percent revenue growth as our target for a new newspaper-industry normal .	1	2015	mh*
88758351	Adding Adding fuel fuel to to the the inflation inflation fire fire , , the the cost cost of of labor labor is is also also surging surging at at the the fastest fastest rate rate in in decades decades . .	2	2022	mh*
2678518	Argentina arguably has bigger problems to worry about -- like how to turn the country around being plagued by inflation , hyperinflation , mass unemployment , and frequent financial crises .	8	2014	mh*
2721752	Blyth and Lonergan argue that inflation fears are overblown , as helicopter drops would be a flexible tool .	8	2014	mh*
2978338	Bank of Japan ( BOJ ) Governor Haruhiko Kuroda has frustrated investors with his habit of surprising markets , and now the central bank 's latest inflation forecast has some questioning his credibility .	1	2015	mh*
86089972	The amount was increased recently to adjust for inflation .	10	2020	mh*
87993911	""" All these factors threaten economic growth , so central banks have a fine line to tread -- raise rates too quickly and the economy could falter , but do n't act and risk inflation racing away , "" said Mould ."	9	2021	mh*
25835307	Hard to say , with the country reeling from hyper-inflation , and the exchange rate shifting so rapidly .	7	2018	mh*
90309602	""" The bond market sees inflation waning ; the Fed chair also confirmed that the Fed is ... slowing and the bond market is happier and bullish with that thought process . """	12	2022	mh*
63670065	The German release indicated a full pass through , but also that CO2 pricing drove core inflation higher .	12	2021	mh*
567853	Summary  America is still gaining jobs under President Obama , but millions more live in poverty , typical household incomes have not kept pace with inflation , and the federal debt is up nearly 90 percent and on pace to double before he leaves office .	10	2013	mh*
3538590	To avoid the tax , an employer would have to keep plan costs below the threshold and contain growth in costs over time to no more than inflation .	8	2015	mh*
1128241	The game 's content has evolved through the years , reflecting changing social values , inflation , and new standards of political correctness .	9	2012	mh*
860265	""" There are a number of ways investors can look to take advantage of the inflation-hedging properties of TIPS without locking in current low yields , "" Mihir wrote ."	4	2012	mh*
19924645	Businesses serving British consumers are suffering compared with export-focused manufacturers , as the weaker exchange rate and higher inflation following last year 's vote to leave the European Union feeds through the economy .	8	2017	mh*
19773066	"The State of the Macro Picture  Now let 's move on to the market 's "" external factors "" - the indicators designed to tell us the state of the big-picture market drivers including monetary conditions , the economy , inflation , and valuations ."	7	2017	mh*
9133047	With national income going down , and prices going up under triple-digit inflation in Venezuela , these complaints are by no means frivolous .	6	2016	mh*
31493969	"Predator - Requiem "" faring the worst at $53 million after inflation ."	12	2019	mh*
25370023	Navigation  Flash estimate of the Consumer Price Index ( CPI )  According to the flash estimate issued by the INE , the annual inflation of the CPI in June 2018 was 2.3% .	6	2018	mh*
32108935	On the other hand , when system-wide debt is high , interest rates run into the zero bound , and measured inflation is very low , monetary policy runs out of ammo .	9	2020	mh*
712592	"Instead it is easier by far to teach soft classes in the humanities and social ( or socialist ) studies and hand out "" feel good "" positive reinforcement grades with grade inflation ."	1	2012	mh*
8656033	On a comparable basis , sales grew 2.7% as inflation rose due to severe drought conditions in Australia . (	8	2019	mh*
89508351	See related article : S.Korea finance minister nominee wants to delay crypto tax for two years Fast facts A 20% tax on crypto asset gains was scheduled to ...  BENGALURU ( Reuters ) -The Philippine central bank will raise rates by a modest 25 basis points for a second straight meeting in June , opting to move more slowly than its global peers in an attempt to cool soaring inflation , a Reuters poll forecast .	6	2022	mh*
89468768	After adjusting for inflation , goods exports were the highest since December 2020 , the last month before the Brexit transition ended .	6	2022	mh*
470115	Go Daddy 's valuation of $4.1bn is based on a deal in 2011 ( adjusted for both inflation and computer growth ) , which reportedly amounted to $2.25bn for 65% of the company .	8	2013	mh*
2675556	But adjust the figures for inflation and film phenomenon The Exorcist makes the cut at number nine .	7	2014	mh*
22267969	Inflation could reach 2,300 percent next year , the International Monetary Fund warned in October .	12	2017	mh*
94508604	While inflation fears persist and many economists predict a recession , the administration seized upon the **29;828;TOOLONG growth figures .	10	2022	mh*
70684663	As such , wage pressure may limit the degree to which inflation can decelerate cyclically .	4	2019	mh*
964630	"Delays will undoubtedly lead to higher costs for taxpayers as defects worsen and repair costs rise due to inflation , "" it reads ."	6	2012	mh*
3629292	""" I believe the active monetary policy currently being implemented by Mario Draghi is the right one to bring inflation close to 2 percent , "" Villeroy said at the hearing . """	9	2015	mh*
8653686	Unconventional easing is above all an expectations game , where it is necessary to shock markets again and again , until they have no reason to question a central bank 's commitment to its inflation target .	5	2016	mh*
19052029	The pilot 's pre-flight routine included poking the tires to ensure proper inflation .	6	2017	mh*
3743936	This cluster -- any movie with less than a 40 percent fresh rating on Rotten Tomatoes and a $100 million inflation-adjusted box office -- includes a lot of Bullock 's early roles .	11	2015	mh*
3446908	Rajan has performed well with policy and leadership of the RBI ; however , the successes from taming inflation can be attributed to luck .	7	2015	mh*
70155282	According to the forecast by Future Market Insights , the global automatic tire inflation system market is anticipated to project a revenue of over US$ 1,500 Mn in 2017 and grow at a steady CAGR of 5.6% during the 10 year period 2017-2027 .	10	2018	mh*
95772786	But with the green energy provisions of the Inflation Reduction Act , the Biden administration is as protectionist as the Trump administration .	12	2022	mh*
161601	So not surprisingly , for the last twenty years or more , low and stable inflation is exactly what the country got .	3	2013	mh*
87539459	Markets will be looking for more color on discussions surrounding inflation risks .	7	2021	mh*
655557	Skyrocketing prices of onion , rice and other food items are threatening to jeopardize Reserve Bank of India Governor Raghuram Rajan 's efforts to curb stubborn inflation and revive an economy that is set to record its slowest pace of growth in a decade this year .	11	2013	mh*
71056419	Now he 's demanding rate cuts , even though the unemployment rate is much lower and inflation at least a bit higher .	7	2019	mh*
3538590	To calculate the HCPT thresholds , we assumed that inflation increase annually by 2.7 percent between 2018 and 2028 .	8	2015	mh*
744610	So I think we have to first realize that on the macroeconomic view it 's a sector , which like dentistry or medicine , is traditionally going to be above the rate of inflation in its cost increases because of the way it 's delivering .	2	2012	mh*
88455010	Each pinched-off island universe would be separated by a vast gulf of nothingness , with the islands flying away from each other faster than light ( because that 's what inflation does ) .	12	2021	mh*
31631549	In November 2019 , the amount required for investment was raised to $1.8 million and $900,000 as a minimum in some areas , to account for inflation , the first increase since 1990 .	2	2020	mh*
7610483	Related News  AUD/USD is seen extending its corrective slide from eight-month peaks , and now drops further below 0.75 handle as markets prefer to capitalize the previous rally ahead of the crucial Chinese inflation numbers .	3	2016	mh*
177215	The Fed is leaving its key interest rate near zero while it tries to reduce unemployment below 6.5 percent and hold inflation below 2.5 percent .	4	2013	mh*
649624	In the years before the financial crisis , financial excess propped the economy up without ever getting to the kind of excess demand that would push unemployment down to unsustainably low levels and cause higher inflation .	11	2013	mh*
2228383	The U.S. earned the best score for affordability of food , which was based on relative food prices and the volatility of food price inflation .	1	2014	mh*
14601	Berger said she stopped accepting new Medicaid patients in her practice because related paperwork proved onerous and government payments , which have not kept up with inflation , were not quickly forthcoming .	1	2013	mh*
18100033	The survey also found that 91 percent of those polled expect rising or unchanged inflation-adjusted sales in the second quarter .	4	2017	mh*
16923363	Of this specific period , Friedman and co-author Anna Schwartz found inflation to be somewhat less than it might have been , perhaps should have been , in relation to gold and money conditions .	2	2017	mh*
693952	Unfortunately , it 's easier to see a crash landing instead of a glide path , given today 's low yields , rising inflation , and looming sovereign risk .	1	2012	mh*
83169441	Why clients should consider a retirement checkupClients are advised to review their retirement portfolio , as they could end up with less than what they have as a result of taxes and inflation , according to this article in Kiplinger .	1	2020	mh*
73740987	"In remarks prepared in advance of congressional testimony Tuesday , Federal Reserve Chair Jerome Powell warned that the recent rise in coronavirus cases in the United States and the emergence of omicron "" pose downside risks to employment and economic activity and increased uncertainty for inflation . """	11	2021	mh*
31774579	In the later inflation , on the other hand , the effects are all bad .	4	2020	mh*
14396760	The Federal Reserve has a goal of 2 percent inflation .	9	2016	mh*
1117902	When people see less growth ( less reason go invest ) and less inflation ( less chance of their money getting eaten away ) they 're content to buy a fixed income security that will pay the same amount every year for several years in the future .	9	2012	mh*
86983075	Biden 's treasury secretary , Janet Yellen , has said the inflation concern needed to take a back seat to worries about not spending enough money to fix the economy .	3	2021	mh*
2539261	As I 've written before , this is not only incorrect , but an ethically dubious position to hold , given the awful reality of mass unemployment , the minor and arguably positive effects of a little inflation , and the strong tools in the Federal Reserve 's arsenal to control inflation should it get too high .	6	2014	mh*
88301617	Do Americans care more about job growth or inflation ?	11	2021	mh*
2955117	December headline inflation sank to its lowest levels since 1999 and deflationary risks are high with inflation expectations among consumers over the next year at a record low , official data showed last month .	1	2015	mh*
16741782	But they 'll decrease the funding or more subtly decrease funding by ignoring inflation .	2	2017	mh*
3491081	Low oil , food and imported goods prices account for much of the drag on inflation , according to Carney .	8	2015	mh*
1014412	So the real price of each plane in a single order can differ significantly due to inflation .	7	2012	mh*
86096081	CardiacSense1 senses the radial artery inflation and deflation and together with a PPG sensors give an ultimate performance that is superior to PPG only .	10	2020	mh*
1167521	In 1980 , it cost an average of about $56,000 ( adjusting for inflation ) to attend a university for four years .	10	2012	mh*
19491581	Optimism in Financial Markets Fails to Show in Real Economy  Though stocks have been hitting records and big U.S. banks reported stronger-than-expected earnings Friday , consumers pulled back their spending at midyear and became less optimistic about the future , while inflation on consumer purchases softened .	7	2017	mh*
92495850	The PCE index tends to show a lower inflation level than CPI .	7	2022	mh*
7000434	Investors will be particularly sensitive to wage growth as the Federal Reserve is appears to be putting much stock in the idea that a tighter labor market will push wages up , and this will lift core inflation over time .	1	2016	mh*
1065684	If you are lucky , there will be inflation and you wont need it .	8	2012	mh*
85799603	The University of Michigan 's survey for 5-10-year inflation was confirmed at 2.7% in August , matching the high for the year .	8	2020	mh*
157055	That allowed photons to travel unimpeded through space , in a pattern that carried the echoes of inflation .	3	2013	mh*
26093291	Actually , Obama 's first three defence budgets were larger when adjusted for inflation , according to Todd Harrison at the Washington-based Center for Strategic and International Studies .	8	2018	mh*
70621907	Americans were confronted by double-digit inflation , soaring meat and oil prices , and lines of angry motorists at gasoline stations .	3	2019	mh*
2705165	Seventy-three percent of Americans support raising the minimum wage to $10 per hour and indexing it to inflation , according to a recent poll .	8	2014	mh*
92339276	Thousands of low-income Florida families are expected to receive relief checks to help offset inflation costs .	7	2022	mh*
31453726	AB 1482 limits annual rent increases to 5% per year plus the cost of inflation , which was 4% in the Bay Area as of April .	11	2019	mh*
