id	text	month	year	assigned
2385229	"The workers have been demanding better wages since inflation has been so high recently , "" said Kalpona Akter , executive director of the Bangladesh Centre for Worker Solidarity to the Guardian . """	3	2014	mh
8535774	In Germany , unemployment fell by 16,000 and wages grew during April , but harmonized inflation fell into negative territory , down 0.3% monthly basis , and by 0.1% compared to a year before .	4	2016	mh
86814317	The average forecast for IPCA consumer price inflation at the end of this year rose to 3.8% from 3.6% , according to the latest weekly ' FOCUS ' survey of over 100 economists .	2	2021	mh
9414437	Ronaldo 's arrogance feels different from the almost comical inflation of Zlatan Ibrahimovic , for instance .	6	2016	mh
31784146	""" I think that the low-inflation paradigm that we are in will most likely end when a ) real interest rate returns are pushed so low that investors holding the debt wo n't want to hold it and will start to move to something they think is better and b ) simultaneously , the large need for money to fund liabilities will contribute to the ' big squeeze , "" he wrote ."	4	2020	mh
31980112	The film was the highest-grossing movie of all time , adjusted for inflation , but its depiction of contented slaves and heroic slaveholders has garnered criticism in recent years .	7	2020	mh
3673978	Indeed , after inflation and taxes , real rates on those instruments are negative .	10	2015	mh
26308487	If the rail authority misses its 2033 target , inflation will likely raise the project 's pricetag by as much as $2 billion a year .	8	2018	mh
2047917	Inflation was running at 5.85% through mid-December , higher than the government 's 4.5% target .	12	2013	mh
14535073	Inflation of Kilauea 's summit reservoir increases the chance of magma intruding into the volcano 's south caldera or upper rift zones .	9	2016	mh
86959021	Bond yields have risen this year as traders have been watching the potential for inflation pressures to pick up after struggling economies were flooded with credit and government spending .	3	2021	mh
7920425	After that , further increases would be indexed to the inflation rate .	3	2016	mh
86090087	"In its policy statement , the Federal Open Market Committee said it expected to hold rates steady near zero -- where they have been since March -- until the job market reached what it saw as full employment "" and inflation has risen to 2 percent and is on track to moderately exceed 2 percent for some time . """	10	2020	mh
2274067	Take paper currency off its pedestal , and inflation is no longer necessary to provide this space for monetary policy , since interest rates can go down , instead of inflation having to go up .	2	2014	mh
15442537	""" With that could come some inflation ."	11	2016	mh
474574	Inflation is going up .	8	2013	mh
2641478	""" The obvious near-term solution is to raise the gasoline tax back to where it was in 1993 dollars and index it for inflation , "" the paper wrote . """	7	2014	mh
2796299	Inflation in Europe is so low there 's a risk of deflation , or falling prices , which would be a perverse development because falling prices discourage people from spending , since goods will be cheaper tomorrow .	9	2014	mh
81624669	Growth has since picked up and inflation has tempered , even as the central bank delivered a series of large cuts to the benchmark lending rates .	10	2019	mh
9745283	Washington 's current minimum wage is $9.47 an hour , but the rate is adjusted each year for inflation as measured by the Consumer Price Index for the past 12 months .	7	2016	mh
20669197	Britain 's inflation rate has accelerated , mainly because of the fall in sterling 's value since a narrow referendum decision in June 2016 to leave the European Union .	9	2017	mh
85007868	As consumption increases , so does the ability for producers to charge higher prices ( inflation ) and for lenders to increase borrowing costs .	5	2020	mh
84897646	Inflation in the United States was just 0.3% last month from a year earlier , weaker than economists expected , as purchases withered amid widespread stay-at-home orders .	5	2020	mh
91755698	""" We think that the public generally sees us as very likely to be successful in getting inflation down to 2% ."	6	2022	mh
14985602	Gold GCZ6 , -0.06%closed mostly flat , pressured by the stronger dollar , but ended the week higher as inflation expectations rose .	10	2016	mh
31877050	Our Common Equity Tier 1 ratio was 10.9% in the quarter , which is comfortably in excess of the regulatory minimum and more than enough to accommodate expected customer demand and RWA inflation .	6	2020	mh
70491806	INFLATION STILL ABOVE TARGET  The BoE sent a reminder to investors that rates might rise more quickly than they expect by saying it saw inflation in two years ' time at 2.1 percent , a touch above its 2 percent target .	2	2019	mh
3883122	"These developments may "" increase the likelihood that headline inflation rates would remain subdued , "" according to the minutes ."	12	2015	mh
563681	Kuttner 's proposed solution unsurprisingly involves massive debt relief , inflation ( at least 4%-6% annually ) , and tight reregulation of financial markets .	10	2013	mh
3270450	The Surprising Impact on Electricity Prices  Electricity costs go up nearly every year because utilities need to make investments in maintaining the grid to serve customers , and those costs rise with inflation .	5	2015	mh
3206535	"He 's open-minded about the proposals : He says there 's nothing "" magical "" about the 2 percent inflation target that the Fed formally adopted in 2012 ."	4	2015	mh
70240135	""" While the uptick in both the core-CPI and core-WPI inflation in October 2018 warrants some caution , the recent pullback in the rupee and crude oil prices has softened the risks to the inflation trajectory , "" she added ."	11	2018	mh
21709093	The day 's economic reports proved to be a mixed bag , with Eurozone inflation slowing slightly as initially estimated in October , while U.K. retail sales rose slightly faster than expected in the month .	11	2017	mh
90384827	Inflation hit 8.5% in March , its highest level since 1981 .	4	2022	mh
16762257	The prospect for accelerating inflation is another reason to own gold , even with the outlook for rising interest rates , he said .	2	2017	mh
23401598	Inflation sagged to 1 percent in January .	2	2018	mh
3547593	"1:29 pm August 31 , 2015  Rohan Parikh wrote :  WSJ writes , "" The deflation of China 's stock bubble should have no more economic impact than its inflation did . """	8	2015	mh
95771729	That 's because even after nine months of repeated Fed rate hikes , inflation-adjusted interest rates are still negative .	12	2022	mh
89641055	( Adds market reaction and comments from Wyden and Whitehouse , starting in fifth paragraph )  ( Bloomberg ) -- Odds are now close to even that the US economy will slip into a recession within the next year as persistent and rapid inflation emboldens the Federal Reserve to pursue larger interest-rate hikes.	7	2022	mh
33772892	SPONSORED :  Inflation tops list of most urgent issues facing US : poll  Americans in a new survey list inflation as the most urgent issue currently facing the U.S. , followed by immigration and the COVID-19 pandemic .	2	2022	mh
24298055	The only way to fight inflation , in fact , is to invest your money in a manner that keeps up with or outpaces it .	4	2018	mh
88384544	Kelly Cunningham , San Diego Institute for Economic Research  YES : The reason for accelerating inflation is an obvious result of the massive quantity of money printing spurred by surging government spending .	12	2021	mh
14685686	"The best CD rates are barely higher than the inflation rate , and savings rates are about 1 percent . """	10	2016	mh
70611952	And watch the rush for hard assets to avoid the inflation tsunami .	3	2019	mh
32167332	During simultaneous acquisition of blood oxygen level -- dependent ( BOLD ) -- fMRI data , the clinician used a button box ( 4 ) to apply electroacupuncture ( EA ) treatment ( real/sham , double-blind ) to the patient ( 5 ) to alleviate evoked pressure pain to the leg ( 6 ; Hokanson cuff inflation ) .	10	2020	mh
88755024	A January survey of economists at the Initiative on Global Markets at the University of Chicago Booth School of Business found most experts in agreement on both questions : Inflation was n't explained by big firms deciding to get richer , and antitrust interventions -- such as those tossed about by the Biden administration -- were n't likely to curb inflation .	2	2022	mh
844690	""" Oil price fluctuations appear to have contributed to higher inflation uncertainly since the crisis ."	4	2012	mh
87125682	People reports Davis found the refreshingly honest ad  Hiring is accelerating as Americans increasingly venture out to shop , eat at restaurants and travel , and inflation pressures are even picking up after lying dormant for years .	4	2021	mh
25848608	The Fed has been trying to strike a delicate balance , raising interest rates gradually in an effort to keep inflation in check without snuffing out the recovery .	7	2018	mh
70550161	However , the events like quarterly inflation report hearings from the BoE officials , the UK PM Theresa May 's statement to parliament and the Fed Chair 's semi-annual testimony might provide a fresh impulse to the traders .	2	2019	mh
86782127	Principal components analysis ( PCA ) reduced the 10 abiotic factors ( exclude TVS with variance inflation factor ( VIF ) &gt; ?	2	2021	mh
91489258	"Prospects of Fed tightening in response to soaring inflation have rattled the markets throughout 2022 , so an expected 75-basis-point rate hike , combined with the start of QT , should provide another test . """	6	2022	mh
8877231	Ahead in the NA session , the USD will take centre stage as US inflation figures and other key indicators are due .	5	2016	mh
85689108	He said that during his tenure , which started in 1987 , an information base that included gold , he made the Fed adjust the federal funds rate to adequately react to inflation expectations .	8	2020	mh
18621192	In another move , the bill would also slash taxes on premium cigars -- from $3.50 to 50 cents each -- and remove inflation-adjusted increases for cigarette taxes that were approved in 2013 .	5	2017	mh
3698724	To them , inflation means an increase in prices .	10	2015	mh
13558185	Source : Bloomberg )  26:40 - Alan Greenspan , former Federal Reserve chairman and founder at Greenspan Associates , discusses the prospect of a U.S. recession and where he sees early signs of inflation in the U.S. economy .	7	2016	mh
25925375	Under the current proposal , however , your tax liability would drop to $50,000 because your original investment , accounting for inflation , was actually $150,000 and therefore your gain was $250,000 .	8	2018	mh
16259520	More importantly , wage growth -- often seen as a precursor to inflation -- picked up to mark the fastest annual increase since a recovery that began in mid-2009 .	1	2017	mh
432713	Inflation is running at more than 35 percent .	8	2013	mh
2266105	The advanced economies , of which the US and Japan are the two largest , are in the midst of a bout of low inflation -- below the 2% target set by both countries ' central banks -- that has economists warning of a need for change .	1	2014	mh
89218217	Proponents say this will lead to a gradual price appreciation , scarcity and a potential hedge against inflation . (	5	2022	mh
73907811	Perhaps my favorite feature of the pad is the included Vortex pump sack that you use for inflation .	1	2022	mh
89667973	In fresh quarterly projections , the board raised to 2.3% from 1.9% its core consumer inflation for the current fiscal year ending in March 2023 .	7	2022	mh
885704	Non-profit organizations can mitigate this risk , however , by allocating to asset classes that benefit from inflation , such as commodities , TIPS , and REITs .	5	2012	mh
19964320	""" Net , net , the rising inflation trend has gone off the tracks with little price pressures reported the last five months ."	8	2017	mh
88476651	Wall Wall Street Street fell fell Friday Friday as as traders traders took took money money off off the the table table after after the the Fed Fed indicated indicated it it would would fight fight inflation inflation by by speeding speeding up up the the withdrawal withdrawal of of economic economic stimulus stimulus . .	12	2021	mh
9744706	"While "" most participants "" expected to see inflation continue to trend up toward the Fed 's 2% target , "" other participants were less confident that inflation would return to its target level over the medium term . """	7	2016	mh
88160085	Since Biden has taken office , inflation , costs of goods , energy and costs associated with hiring and keeping employees have skyrocketed .	10	2021	mh
33473089	With his approval ratings flagging , United States President Joe Biden has been working to show both empathy and action in tackling supply-chain issues , as well as inflation and its impact on American pocketbooks as the US enters its holiday season File : Stefani Reynolds/Bloomberg  President Joe Biden said his administration has made strides toward relieving U.S. supply-chain disruptions , as he met Monday with the leaders of major retailers including Walmart Inc. who assured him they have ample inventories for the holiday season .	11	2021	mh
14390218	( Editing by Elaine Hardcastle )  Next In Business News  WASHINGTON U.S. consumer prices rose more than expected in August as healthcare costs recorded their biggest gain in 32-1/2 years , pointing to a steady build-up of inflation that could allow the Federal Reserve to raise interest rates this year .	9	2016	mh
70350416	Lower cost inflation should therefore set the stage for a recovery in economic activity and further profit growth into 2019 .	12	2018	mh
3487962	We wanted him to take the phone , look at the text messages , e-mails , run the search terms that we set forth and give us any communications with anybody about deflation or inflation .	8	2015	mh
24319480	The 10-year yield , a benchmark for global borrowing costs , has been driven steadily higher by a combination of concerns over inflation , growing debt supply and rising Federal Reserve borrowing costs .	4	2018	mh
929861	Still , there 's no need to suppose that serious membership inflation is that rampant .	5	2012	mh
86650899	The central bank official said current inflation measures are being held down by virus-sensitive sectors that could rebound quickly once vaccines take hold .	1	2021	mh
26039970	That 's the increase in hourly wages , adjusted for inflation , for the typical black worker in Florida from 2000 to 2017 , according to a new study from Florida International University .	8	2018	mh
31946102	Here are some lower-risk market bets so you do n't just sit in cash  A recession and volatile stock market can lead investors to keep their money in cash , but beware of lost time in the market and inflation .	7	2020	mh
83221932	Inflation raises project cost .	1	2020	mh
9019829	And if inflation somehow rears up again , stocks will likely be the asset of choice , given their proven ability to rise alongside inflation -- a connection that makes sense given that companies can generally pass along higher prices to their consumers .	5	2016	mh
2407239	the worst of an economic storm caused by the annexation of Crimea , but acknowledged the crisis had taken a toll on economic growth and driven up inflation .	4	2014	mh
2764794	Like many countries , the U.K. faces low inflation highlighted by low wage growth .	9	2014	mh
2377734	Even a developer of inflation theory , Andrei Linde , is not entirely convinced .	3	2014	mh
4784584	The Bank of Japan 's unprecedented stimulus and Abe 's pro-growth reforms have yet to spur a recovery in inflation and gross domestic product growth , and the country is yet again in recession .	11	2014	mh
25204223	Perhaps the most striking example is the disappearance of the Phillips curve -- the hypothesized inverse relationship between inflation and unemployment .	6	2018	mh
2470065	And after holding near a two percent annual inflation rate ( which is where the Fed wants it ) the measure is pushing towards the three percent level as the recovery in home prices filters into the government 's inflation calculations .	5	2014	mh
70762357	Document  Agenda details UCA tuition and fees + room and board  For years , public colleges and universities have raised tuition and fees because of stagnant state funding that does n't keep up with inflation and other needs , leaders say .	5	2019	mh
2547327	This measure is defined by an income threshold that is dependent on family composition and income , adjusted for inflation .	6	2014	mh
4784878	Graham discusses how to allocate your capital across stocks and bonds , how to analyze mutual funds , how to take inflation into account , how to think wisely about risk and , especially , how to understand yourself as an investor .	11	2014	mh
24059109	He said while business executives were saying that rising trade tensions had become a bit of a risk to the economic outlook , Fed officials felt it was too early to determine what the impact will be in such areas as inflation .	4	2018	mh
483270	Investopedia noted that during the 10 years ending in 1982 , inflation averaged 8.7 percent annually , causing the price of items to almost double within that decade .	8	2013	mh
82039534	The consumer-price index rose 0.54% from the end of September , leaving the 12-month inflation rate at 3.02% , practically unchanged from the previous month , the National Statistics Institute said Thursday .	11	2019	mh
3261460	One problem posed by low inflation is that it holds up inflation-adjusted interest rates .	5	2015	mh
1103110	In his landmark 1963 study of the Great Depression , the late Murray Rothbard argued that the quest for price stability had been one of the reasons that economists of the 1920s failed to notice the monetary inflation that was occurring . (	8	2012	mh
15054630	The bank once said this tactic would quickly produce 2% inflation .	10	2016	mh
764105	Many variables , including life expectancy , inflation , investment return , are subject to educated guesses which sometimes can lead to rosier projections .	2	2012	mh
70391085	They do this to meet up with cost of living and inflation .	1	2019	mh
3626100	Despite the more pronounced commodity price boom , growth rates over the last decade have been in line with earlier boom episodes and inflation rates have remained more subdued .	9	2015	mh
17432976	"Inflation is moving up and "" people can feel good about the economic outlook . "" --"	3	2017	mh
9152767	"We do n't know how long it 's going to last but for the moment it 's helping the inflation rate to come back . """	6	2016	mh
87779300	After U.S. inflation surged 5.4% in June from a year earlier in its biggest monthly gain since August 2008 , it once again rose 5.4% in July .	8	2021	mh
32048985	The Fed 's official inflation target is 2 percent .	8	2020	mh
1018966	In other words , even after adjusting for inflation , most Americans make more than their parents -- but few have actually been able to change their socio-economic class . (	7	2012	mh
82622481	""" Every enterprise has fixed cost like wages-chemicals that go up over the years there is inflation , "" said Councillor Greg Neitzert . """	12	2019	mh
16447819	"Celebrities or not , inauguration price tag of $200 million could top record ( even adjusted for inflation )  President-elect Donald Trump and his team have called his inauguration a "" people 's "" celebration , in contrast to the celebrity-packed celebrations of past years ."	1	2017	mh
87269001	We We used used genomic genomic inflation inflation ( ( ? ?	5	2021	mh
85914584	As volatility increases with market stress , the options benefit from relative interest rate moves , whether those moves are lower ( or negative ) rates in near-term maturities - often associated with Fed rate cuts - or higher rates in long-term maturities as a result of increasing expectations of future inflation .	9	2020	mh
3875626	""" With underlying inflation still strong , the Bank of Japan will likely leave policy settings unchanged at its January meeting unless next week 's tankan disappoints significantly , "" Capital Economics ' Japan economist Marcel Thieliant wrote in a research note ."	12	2015	mh
7065979	This second , milder , period of inflation , characterized by a rapid increase in volume , would dilute primordial particle abundances , potentially leaving the universe with the density of dark matter we observe today .	1	2016	mh
91599967	"Brian Deese , director of the National Economic Council , admitted that inflation and high gas prices have created "" real economic hardship . """	6	2022	mh
2678354	A bit of inflation could induce them to invest , which might yield more rapid economic growth .	8	2014	mh
32731071	The US economy is poised for a powerful surge this year -- one that 's expected to put millions more people back to work and push inflation higher to a more desirable level , according to Eric Rosengren , president of the Federal Reserve Bank of Boston .	4	2021	mh
18276054	""" And in the last 12 months , as I said , inflation rate was down , and basically in negative territory ."	5	2017	mh
89642118	There are still residual effects impacting performance from material shortages , supply chain disruptions , and inflation , but with a conservative management team that has deliberately employed a balanced approach to capital allocation by directing half its cash flows to shareholders and reinvesting the rest into the business .	7	2022	mh
13572944	The BOJ 's choices will help it avoid a backlash on that front but risk hurting sentiment among investors who expected more-aggressive action to counter faltering inflation and a stronger currency .	7	2016	mh
70200556	While inflation is picking up and at 2.2 per cent in October is now above the ECB 's 2 per cent target , much of this is due to once-off energy price rises .	11	2018	mh
2684313	"When you ca n't find cheap coffee anywhere it 'll be inflation , "" Macke adds . """	8	2014	mh
33740564	Therefore , total inflation would n't have jumped as much .	2	2022	mh
89899517	For For example example , , in in the the South South , , where where homes homes are are often often already already fully fully electric electric , , and and switching switching to to heat heat pumps pumps is is straightforward straightforward , , the the rule rule could could take take effect effect in in this this decade decade , , while while states states in in colder colder climates climates -- -- in in which which heat heat pumps pumps are are still still an an emerging emerging technology technology and and older older homes homes may may require require electric electric upgrades upgrades that that are are eligible eligible for for Inflation Inflation Reduction Reduction Act Act subsidies subsidies as as well well -- -- would would have have until until 2030 2030 . .	9	2022	mh
23640110	Headline inflation may have edged up to 2.2 percent in February from 2.1 percent , though consensus before Tuesday 's report is for core inflation to remain at 1.8 percent .	3	2018	mh
23790797	With inflation at bay ; the dollar is enjoying a broadly stronger position relative to other world currencies .	3	2018	mh
94777589	On a monthly basis , inflation rose 0.4% , the same increase as in September , the BLS said .	11	2022	mh
2891904	Since the breakdown of the Bretton Woods international monetary system in the early 1970s , most countries have faced bouts of high and volatile inflation as they sought a suitable nominal anchor .	10	2014	mh
14999499	If you adjust the dollar amounts for inflation , you find that Wisconsin actually spent 5.4 percent less per student in real dollars in 2014 than in 2005 , said Tamarine Cornelius , a policy analyst with the Wisconsin Council on Children and Families .	10	2016	mh
85015238	The bank and the federal government are due to renew the inflation goal next year .	5	2020	mh
75597	What is the highest withdrawal amount as a percentage of retirement date assets that with inflation adjustments will be sustainable for the full 30 years ?	2	2013	mh
744390	Inflation is then likely to decline further as the contribution of energy and import prices diminishes , while downward pressure from unemployment and spare capacity continues to restrain domestically generated inflation .	2	2012	mh
87253942	More than a third of the increase in average ticket for the home improvement retailer was a result of commodity inflation  Referenced Symbols  Inflation from skyrocketing lumber prices had a big impact on Home Depot Inc. ' s fiscal first-quarter results , but some Wall Street analysts appear surprised at just how willing the home improvement retailer was to pass the higher costs onto its customers .	5	2021	mh
24952611	Currently elevated inflation should recede quickly and fiscal consolidation is set to bring the deficit below the WAEMU threshold by 2021 .	6	2018	mh
85021179	When the dollar is no longer viewed as the ultimate safe haven , we will see inflation , higher rates , and widespread defaults .	5	2020	mh
82438054	"Rents , which had been climbing faster than inflation , finally dipped , even compared with the same time a year prior . """	11	2019	mh
86851849	"Fed officials in recent days have largely been in sync in their comments that they do not see inflation becoming problematic , after Chair Jerome Powell indicated last week the central bank will remain accommodative until inflation has exceeded 2% . """	3	2021	mh
395388	Another large part of the gap comes from how analysts adjust compensation and productivity for inflation .	7	2013	mh
462432	In Hawaii , that translates into a 2013 package of $49,175 -- up $7,265 from an inflation-adjusted $41,910 in 1995 .	8	2013	mh
