id	text	month	year	assigned
3914074	"The committee , in its statement , also noted that "" market-based measures of inflation compensation remain low ; some survey-based measures of longer term inflation expectations have edged down . """	12	2015	az
70023041	With the unemployment rate low and inflation near the 2% target , most economists see the Fed sticking to a gradual rate hike pace until the middle of next year .	9	2018	az
2489740	09 global financial crisis unfolded while U.S. inflation remained perfectly benign .	5	2014	az
81653507	The union has proposed a 5% annual raise during the next three years and officials argue that teachers ' most recent contract , which expired this summer , did n't keep pace with inflation in the city .	10	2019	az
23232402	Historically , rising inflation has n't always meant sinking equity markets .	2	2018	az
22309044	""" Why are we raising rates when inflation is low and falling ? """	12	2017	az
70317075	"The rules , such as the well-known Taylor rule used to guide Federal Reserve policy since the 1990s until the financial crisis , should be updated to use modern-day inflation expectations , and a lower neutral interest rate , Bullard said . """	12	2018	az
82723759	"The Unfunded Mandates Reform Act of 1995 ( section 202(a) ) requires us to prepare a written statement , which includes an assessment of anticipated costs and benefits , before proposing "" any rule that includes any Federal mandate that may result in the expenditure by State , local , and tribal governments , in the aggregate , or by the private sector , of $100,000,000 or more ( adjusted annually for inflation ) in any one year . """	12	2019	az
85793557	"Akers , who recently published a report on college tuition inflation , noted that tuition remaining the same while the college experience diminishes "" is going to push consumers , the students , to say : ' What am I paying for ?"	8	2020	az
3649213	The price of gold has fluctuated widely over the last five decades , due to various factors like fear of inflation , as well as everyday political and economic events .	10	2015	az
15427008	"The thinking was that the earlier measure 's use of what was called the "" sustainable growth rate "" would help restrain the upward pressure on doctors ' rates and combat health care inflation ."	11	2016	az
131261	The Japanese government has a national debt equal to more than twice its GDP , yet is fighting both deflation and an over-valued currency , rather than inflation and a collapsing currency .	3	2013	az
277362	Inflation adjustments will be made to those compensation limits every two years .	5	2013	az
24316294	""" At the end of the day , we want to influence economic activity , expectations and the exchange rate , "" Espenilla said , parrying criticism about the central bank 's supposed inaction on inflation . """	4	2018	az
70554371	Following Presidential elections in 2018 , Colombia 's outlook is marked by higher expected GDP levels and lower expected inflation levels compared to Latam on average .	2	2019	az
31500557	That is a consequence of liberalisation and implies that combating inflation also requires rethinking liberalisation .	12	2019	az
62743537	At this point it 's unclear if the recent spike in prices is simply the result of supply chain disruptions cause by COVID and should ease materially as more capacity comes on line or if the rise in input prices is a true measure of resource constraints that could usher in an unwelcome cycle of ever higher inflation expectations .	3	2021	az
17358143	It is good that European economies seem to be growing somewhat faster and that inflation is picking up a bit , but it is still my belief that the value of the euro will continue to decline against the US dollar .	3	2017	az
16609994	Inflation is coming , and valuations are crazy .	1	2017	az
245832	The inflation rate is higher for medical care than for other goods .	5	2013	az
1219521	This link made the Saudi economy prone to massive inflation and led to a decline in the purchasing power of the Saudi riyal .	11	2012	az
85819346	We already can see the fear of inflation and high liquidity impacting the price of gold .	9	2020	az
16943189	In 1989 , WIBW-TV purchased the Sky Eye for $375,000 , which would be more than $726,000 today after you calculate inflation .	2	2017	az
86902121	""" On its own , this is usually bullish gold , "" BofA said of increased inflation expectations . """	3	2021	az
2764583	With inflation on the rise , the midi was an economic encumbrance , too ; the longer length required a higher price point .	9	2014	az
7281237	Illinois has one of the nation 's smallest state workforces per capita , while inflation-adjusted payroll has held steady for a decade and represents barely 7% of total state spending .	1	2016	az
7395483	Mauldin Economics  Source : FT  Even the most novice investor can understand that owning a bond with a negative yield in a high inflation environment is the most nonsensical thing ever .	2	2016	az
88974060	""" This is the first time that our generation is experiencing such a historic rate of inflation , and it is hurting family budgets across America , "" Stefanik said . """	3	2022	az
1197488	"Higher cap gains would be tantamount to a financial transactions tax , and would mitigate some of the value of speculation , which has created the only "" inflation "" we see today in oil , debt instruments and the like ."	10	2012	az
70024883	That 's a sign inflation pressures could be easing .	9	2018	az
3538590	We also used the Trustee 's assumed annual inflation from 2015 to 2028 to calculate the maximum FSA contribution amounts .	8	2015	az
914289	Since the Fed 's policy works with a lag , it must make policy based on its best forecast of inflation .	5	2012	az
70583456	The central bank appears to have misread the low official jobless rate as a sign that full employment was at hand and inflation pressures lurked just around the corner , repeating a mistake it has made several times since the Great Recession .	3	2019	az
63231189	"Holders keep "" hodling , "" and inflation benefits the crypto market  On-chain analysis firm Glassnode highlighted that coins held for 12 months and longer are not being moved despite the strong rally , indicating a "" holding behavior . """	8	2021	az
83153901	Minutes of that meeting released last week showed officials were still concerned about economic weakness abroad and subdued inflation , which ran below the Fed 's 2% target last year .	1	2020	az
22477964	ECB Governing Council member Erkki Liikanen 's latest view is also commensurate with the pessimistic ECB inflation forecasts .	12	2017	az
89988303	They have asked for a meeting with Truss and Kwarteng in an open letter , prompted by reports saying cabinet ministers are being told that they must manage within existing budgets , even though inflation means they may be going down in real terms .	9	2022	az
89480474	"30;3285;TOOLONG  07:09 PM  Committee says inflation high despite economic activity uptick  The Committee said : "" Overall economic activity appears to have picked up after edging down in the first quarter ."	6	2022	az
24644438	And , I think we 've shown that since the Great Recession , that we were concerned with inflation being too low .	5	2018	az
70742108	Traders betting on a rate-cut were surprised when Powell said on Wednesday the recent decline in inflation was unlikely to last , dampening speculation of policy easing later this year .	5	2019	az
13795912	With a cloudy economic outlook and inflation under control , most economists expect the bank to remain on hold in the coming months as long as the U.S. Federal Reserve does n't raise rates .	8	2016	az
89538312	This is despite several unions calling for a pay increase at or above inflation , which on Wednesday was estimated to hit 9.1% on the CPI measure and 11.7% for RPI .	6	2022	az
1046712	From vocal Fed critics , the most commonly cited danger is that the central bank 's policies will eventually lead to higher inflation down the road .	7	2012	az
8393298	Looking forward , it is essential to preserve an appropriate degree of monetary accommodation as long as needed in order to underpin the momentum of the euro area 's economic recovery and in order to accelerate the return of inflation to levels below , but close to , 2% .	4	2016	az
7762801	"One of them noted "" there would be an increase in confusion and anxiety among financial institutions and depositors , "" considering the public 's limited understanding of the need for 2% inflation ."	3	2016	az
4784878	Elroy Dimson , Paul Marsh and Mike Staunton , Triumph of the Optimists  Neither light reading nor cheap ( it 's hard to find online for less than about $75 ) , this book is the most thoughtful and objective analysis of the long-term returns on stocks , bonds , cash and inflation available anywhere , purged of the pom-pom waving and statistical biases that contaminate other books on the subject .	11	2014	az
644324	In monetary policy , hawks have a laser-like focus on inflation .	11	2013	az
143378	Furthermore , during these nearly 15 years , most governments have managed their accounts responsibly : small or no fiscal deficits , low inflation , well-targeted anti-poverty programs , and so on .	3	2013	az
86056436	San Francisco  Jane Tyska/Digital First Media/East Bay Times/Getty Images  As for San Francisco , the UBS report explained that inflation-adjusted home prices in the city are still around 65% above their lowest level in 2012 .	10	2020	az
70080543	The country has been hit by one of the world 's highest inflation rates and a currency crisis that has seen the peso depreciate by more than 50 percent so far this year .	9	2018	az
7816117	"If the ECB and BoJ can not get rates down enough to jump-start inflation expectations , and if the US feels the need to have very low real rates in order to give inflation expectations a further kick , even as actual inflation rises , then a stronger dollar is out of the question for now . """	3	2016	az
88188135	REUTERS/Ralph Orlowski  FRANKFURT , Oct 29 ( Reuters ) - The European Central Bank can end emergency bond purchases next spring and needs to watch consumer prices as persistently high inflation could require a reduction of stimulus , Estonian central bank chief Madis Mueller said on Friday .	10	2021	az
304459	Yes , Disneyland 's price increases are still tough for a family to handle , but it 's nice to know that an investment in happiness would have kept up with inflation .	6	2013	az
70023936	Britain 's economy has slowed since June 2016 's Brexit vote , with consumers under pressure from a jump in inflation driven by the weaker pound and some businesses ' reluctance to invest while the terms of a future EU trading relationship remain unclear .	9	2018	az
291889	From 2003 to 2012 , the value of dog bite claims increased 51% , a rate that far outpaces inflation .	5	2013	az
87880345	The first being that inflation can impact technology businesses .	9	2021	az
88577627	"The The minutes minutes of of the the Federal Federal Reserve Reserve 's 's December December meeting meeting , , released released last last night night , , shows shows that that Fed Fed officials officials were were concerned concerned about about America America 's 's "" "" elevated elevated levels levels of of inflation inflation "" "" , , and and considering considering normalising normalising monetary monetary policy policy faster faster to to combat combat rising rising prices prices . ."	1	2022	az
34607	Investors are even paying us for 30-year Treasury bonds , when adjusted for inflation .	1	2013	az
409485	"The monetarists pointed out ( correctly ) that sooner or later , "" quantitative easing "" must end in an explosion of inflation ."	7	2013	az
79636	If they held costs to no higher than the rate of inflation , it would certainly help .	2	2013	az
70881657	2000  * Notable computer : Gateway Performance 1500  * Price tag : $3,089  * Inflation adjusted price : $4,513  The first computers with Pentium 4 processors became available in 2000 .	6	2019	az
450136	In its report , the White House estimates that weather-related power outages have cost the U.S. economy an inflation-adjusted annual average of $18 billion to $33 billion over the past decade .	8	2013	az
2541509	Brazilian Discontent Ahead of World Cup  President Rousseff Gets Poor Marks on Key Issues  The national mood in Brazil is grim , following a year in which more than a million people have taken to the streets of major cities across the country to protest corruption , rising inflation and a lack of government investment in public services such as education , health care and public transportation , among other things .	6	2014	az
860293	And their insecurity has increased , as prices for basic foodstuffs soar in a wave of inflation that has swept across the region this spring , hitting the working poor hard .	4	2012	az
24490328	Meanwhile , the central bank has an inflation target range of between 2 and 4 percent .	5	2018	az
2011630	""" I think he points out the sometimes self-inflation of on-camera television journalists , but as with satire , it 's a serious comment and we need to take it in and be able to laugh at it , enjoy it , and maybe do something about it . """	12	2013	az
18696584	By Steven ScheerJERUSALEM , May 29 ( Reuters ) - Israel 's central bank is expected to leave short-term interest rates unchanged for a 26th straight month on Monday , as the economy softened in the first quarter while inflation eased last month .	5	2017	az
862419	They swoop in with incredible speed and force to bail out the financial sectors in which creditors are invested , trampling over prior norms and laws as necessary .... They do not pursue monetary policy with sufficient force to ensure expenditure growth even at risk of inflation .	4	2012	az
87024365	"PRITHVIRAJ SRINIVAS , CHIEF ECONOMIST , AXIS CAPITAL , MUMBAI  "" The MPC 's decision came in line with expectations given the uncertain demand and inflation outlook due to a resurgence in COVID-19 cases ."	4	2021	az
92730765	Wage gains are among the components of inflation that some say will be hard to eradicate .	8	2022	az
86243300	""" They were of the opinion that this low interest rate level  supports the recovery of economic activity and the gradual return of the inflation rate to within the target range , and particularly in view of the Bank of Israel operating additional tools in the credit market , "" the minutes said ."	11	2020	az
70637885	Her research found that high school grade point average is a better predictor of academic success for first-year students at CSU but not quite ... Read More  Actually , Bo , grade inflation notwithstanding , grades generally have proven to be a more effective predictor of academic success , at least in the first year of college .	3	2019	az
2919950	"He said , "" waiting too long to begin raising rates -- especially waiting until we have fully met our goals for maximum employment or attained our inflation target of 2% -- is risky because doing so could put monetary policy behind the curve . """	11	2014	az
86582003	"We believe the Fed 's policy of tolerating a modest overshoot of its long-term inflation target is likely to be tested . """	1	2021	az
472280	Brazilian inflation is currently 6.15% , close to the 6.5% ceiling of the central bank 's target range for 2013 .	8	2013	az
3412727	There is unlikely to be any spike up in inflation , given the strong dollar DXY , +0.01% , lack of wage dynamism and the scope for firms to absorb cost increases into their profit margins .	7	2015	az
90147582	Biden 's net approval rating flipped from positive to negative last summer , as inflation was pushing through 5% on its way to a peak of 9% earlier this year .	11	2022	az
70733114	So we pushed hard for price increases to make sure that we 've covered inflation in 2018 , and we realized the majority of that actions in the second half .	4	2019	az
23001339	Arguably its depreciation has been an important driver of the run up in oil prices to which breakeven inflation and bond yields have been well correlated .	2	2018	az
8381768	"This is a substantial change from times past when homeowners faced a stiff "" inflation tax "" on the increased value of their homes ."	8	2019	az
2544515	Double-digit inflation and interest rates were wiped away .	6	2014	az
1080305	A loss of confidence in paper money could result in searing and startling inflation , evaporating life savings and turning every stolid worker into a frantic speculator .	8	2012	az
70017042	"Rival Rival Cairn Cairn Homes Homes , , meanwhile meanwhile , , calculated calculated that that "" "" annualised annualised build build cost cost inflation inflation "" "" was was 2.9 2.9 per per cent cent when when it it released released its its interim interim numbers numbers recently recently . ."	9	2018	az
9924890	Experts have also been warning of massive inflation since the Federal Reserve began quantitative easing .	7	2016	az
82209836	"Everything was discused including interest rates , negative interest , low inflation , easing , Dollar strength &amp; its effect on manufacturing , trade with China , E.U. &amp; others , etc. , """	11	2019	az
33521428	The Fed believes the elevated level of inflation is largely driven by pandemic-related forces , however , suggesting inflation will moderate as the pandemic ebbs .	12	2021	az
70219938	"Meanwhile , the "" optimal "" investment scenario called for the city to immediately increase its combined annual spending on the road , water and sewer networks to $524 million in 2016 , and index the amount for inflation each year thereafter ."	11	2018	az
19641445	The crucial question is how worried are Fed officials about a recent downturn in inflation ?	7	2017	az
33403881	Needle of a disposable syringe with a drop of liquid on the tip against the background of a fragment ... + of a US dollar bill  getty  To take the last point first , the original wartime profits tax was part of a larger effort to control inflation in an economy almost wholly given over to war production .	11	2021	az
17432165	If these policies materialize , they are likely to boost economic growth and spur inflation , potentially forcing the Fed to hike rates more quickly to keep up .	3	2017	az
553335	The Pew Research Center says that would be equal to $2.1 billion now , when adjusted for inflation .	10	2013	az
85676089	To others , however , it suggests that the markets are reacting instead to pledges by the Fed that it would keep nominal rates near zero even if inflation ticked up a bit .	8	2020	az
88371505	"But the foremost imperatives of Biden 's anti-inflation policy should be to "" look busy "" and "" first , do no harm . """	12	2021	az
89168004	The dollar has risen around 7% against a basket of currencies in the past year to its highest level since March 2020 , boosted in part by expectations the Fed is ready to employ robust rate hikes to tame the worst inflation in nearly 40 years .	4	2022	az
22727597	The best part is that it is a far superior strategy to draw 4% inflation-adjusted income ( on the invested capital ) compared to index investing since it lets you do this without ever selling the shares .	1	2018	az
21448987	""" The market seems to be , in my view , making the same mistake it made earlier in the year which is focusing too much on growth and not enough on inflation , "" Kallum Pickering , senior U.K. economist at Berenberg , told CNBC Thursday ."	11	2017	az
31983626	Without more discipline at the Fed , inflation could easily get out of control .	7	2020	az
92289939	Investors had been awaiting this earnings season for clues on how companies are coping with the worst inflation in more than 40 years .	7	2022	az
2062517	Economist Peter Schiff stated that the Federal Reserves monetary policies would lead to 20 percent inflation within one year .	12	2013	az
31828690	Bonds pay literally nothing when you account for inflation and taxation .	5	2020	az
31659769	This will trigger cost push inflation as companies will produce at higher cost and pass the cost to the consumer .	2	2020	az
1054903	The prefix means little for the end user , and P , non-P , and LT tires are interchangeable , though LT tires generally have higher load ratings ( see service description ) and are designed to use higher inflation pressures .	7	2012	az
786980	This enormous variability in the inflation rate filters through to other economic statistics , as well .	3	2012	az
589840	"Revisiting the "" very important customer "" example , what if inflation makes the $100-per-day customer less valuable ?"	10	2013	az
70107905	""" When I look at Amazon , I 'm seeing a company that 's working to control wage inflation by embracing automation at its warehouses and eliminating monthly bonuses and stock grants , "" Cramer said . """	10	2018	az
23024987	Traders are concerned that with the jobs market picking up steam , inflation will follow .	2	2018	az
1277556	How a great Federal Reserve chairman conquered the inflation dragon with ideas , consensus building and a willingness to tough it out .	12	2012	az
250461	Iran has experienced double-digit inflation figures for most of the past three decades .	5	2013	az
89541850	"Summers told Bloomberg that it was a "" very difficult thing "" and emphasized that it was important that we "" slay the inflation dragon "" if the country is going to go through a "" period of pain . """	6	2022	az
525213	With no end for inflation in sight -- Venezuela 's president has argued that economic crisis is merely temporary -- its central bank may be forced to churn out even bigger bills .	9	2013	az
2406942	GM : So , you 're saying that we should mark the end of inflation as the big bang ?	4	2014	az
892146	Despite the turmoil of the past five years , inflation has averaged almost exactly the 2 percent rate that the FOMC designated as our medium-run target .	5	2012	az
15802705	Draghi Indicates Consensus , but Not Unanimity Behind QE Decision  ECB 's Inflation Forecasts  Mario Draghi Begins His News Conference  Key Points : Less but for Longer  *The bank will continue stimulus as planned at ?	12	2016	az
9021496	Inflation is roughly in line with the Bank 's expectations .	5	2016	az
2470065	MoneyWatch  Americans face threat of higher inflation  Economists can talk until they 're blue in the face about how there 's no meaningful jump in the core annualized inflation rate or the Producer Price Index .	5	2014	az
3766996	For example , if the 10-year Treasury currently has an interest rate of x% while a similar maturity TIPS has a rate of y% we might imply that expected inflation is x -- y% .	11	2015	az
39127	The Bank recognizes that the inflation rate consistent with price stability on a sustainable basis will rise as efforts by a wide range of entities toward strengthening competitiveness and growth potential of Japan 's economy make progress .	1	2013	az
90342940	"The report comes as U.S. central bankers began their last policy-setting meeting of 2022 .. And it could allow them to ease up some on their inflation fight .. says Alex Pelle , U.S. economist at Mizuho USA.PELLE : "" ... I think what this means is that the Fed can be more comfortable in slowing down its pace of rate hikes ."	12	2022	az
81265024	When individuals with infections caused by antibiotic-susceptible organisms are used as control-patients , the relationship between case-patients and certain risk factors , particularly antibiotic exposures may be biased resulting in the incorrect identification of an antibiotic as a risk factor because of inflation of the measure or effect or odds ratio.	9	2019	az
19964320	"Today 's report is just the sort of ammunition the Fed doves need to argue against additional rate hikes this year or even next year if they do n't get confirmation that inflation is headed higher towards the Fed 's 2.0 percent target . """	8	2017	az
63122709	Members generally expected inflation to ease as the effect of these transitory factors dissipated , but several participants remarked that they anticipated that supply chain limitations and input shortages would put upward pressure on prices into next year .	7	2021	az
70813135	Schools in the Bay State , for example , increased spending 22 percent from 1999 to 2009 -- the period of its greatest NAEP gains -- or about $3,000 per child in inflation-adjusted dollars .	5	2019	az
31524110	Again , from the standpoint of recent history , a breakeven rate this low is not unusual , but it is interesting to note that inflation expectations have been rising in recent weeks .	12	2019	az
806749	The real rate takes into account inflation , so consumers probably felt the pinch when you consider the nominal amount paid for electricity climbed 37.2% during the same period .	3	2012	az
87373743	For that reason , many investors are taking the view that , even if Thursday 's US inflation data comes out stronger than expected , markets will still shrug it off .	6	2021	az
145959	"The American Taxpayer Relief Act of 2012 made permanent a maximum estate tax rate of 40 percent ; it also set the exclusion amount at $5 million and allowed for inflation adjustment , continuing the tax relief to most farm estates . """	3	2013	az
31283298	We reasoned that 97% OTU clusters would be more conservative relative to 100% OTU clusters , given that any sequencing errors , as well as sequences that had less than perfect match among multiple copies of the 16S rRNA gene from the same genome , would result in inflation and potential overestimation of the core .	9	2019	az
21263881	We believe that whoever is appointed is likely to adhere fundamentally to the course charted by Governor Kuroda -- i.e. , proceed forcefully with easing and keep the 2% inflation target .	10	2017	az
70395763	They 've settled on a cap of 7 percent plus inflation and will require landlords to provide cause for evictions after the first year in a unit .	1	2019	az
